Crime ID,Month,Reported by,Falls within,Longitude,Latitude,Location,LSOA code,LSOA name,Outcome type
c267089befb1c1a21279c528999b3c3879578993cd26e77248c88390c5d43233,2020-07,Wiltshire Police,Wiltshire Police,-2.199285,51.419807,On or near LEAFIELD WAY,E01031941,Wiltshire 018D,Investigation complete; no suspect identified
e3220fd21001770eff12bba4d28881aed0553b7b250e905cc6bda80ea58e6180,2020-07,Wiltshire Police,Wiltshire Police,-1.754426,51.564547,On or near SPENSER CLOSE,E01015572,Swindon 016B,Investigation complete; no suspect identified
9d0ebc856d68b12f0318d8e7b45e01017bb342b86274d62d88410253a74d0eb8,2020-07,Wiltshire Police,Wiltshire Police,-1.798941,51.069626,On or near PRIORY SQUARE,E01032014,Wiltshire 056A,Suspect charged
ac2c713bb2903ea6f488e55de81d4164a6b5bfba14aafa6746abb863d1dabd83,2020-07,Wiltshire Police,Wiltshire Police,-2.133937,51.370150,On or near ROPE WALK,E01032068,Wiltshire 022D,Unable to prosecute suspect
767a1aca00e7471cfd348ebc55a9d5ce81b1e0373347bd9095f821ae1cb478c7,2020-07,Wiltshire Police,Wiltshire Police,-1.816732,51.554320,On or near MARKENFIELD,E01015568,Swindon 014D,Investigation complete; no suspect identified
f551814070cbb6c7a0e6f4d241f6df03ebcbc2b1fdc6d93abf9adb03360f10d6,2020-07,Wiltshire Police,Wiltshire Police,-1.800335,51.567133,On or near MANTON STREET,E01015578,Swindon 012B,Investigation complete; no suspect identified
af01e9909ea5e0757156bde621ed14bdadced11681bd7a8611a72f3232079b92,2020-07,Wiltshire Police,Wiltshire Police,-1.854446,51.428465,On or near GREEN STREET,E01031884,Wiltshire 012E,Investigation complete; no suspect identified
0a3df59db74a65a297c51f44fe2e4704d220500adaa11821d936c29d5d80bc1d,2020-07,Wiltshire Police,Wiltshire Police,-2.201129,51.319071,On or near Pedestrian Subway,E01032101,Wiltshire 032C,Investigation complete; no suspect identified
c1d4facf2f3ad847f54326b7bf2ed443606047ef5d70b6771a9f5228d3b9f7b4,2020-07,Wiltshire Police,Wiltshire Police,-2.196917,51.253536,On or near MUSTANG CLOSE,E01032694,Wiltshire 040G,Unable to prosecute suspect
57e730d97af7ab97c7db9f13ccfe11f71e7da354d396427a1bb47d3c5cebe839,2020-07,Wiltshire Police,Wiltshire Police,-1.655438,51.240023,On or near KENNET ROAD,E01032697,Wiltshire 041G,Investigation complete; no suspect identified
8032f8fe0d34a876352c2875ada52347112629d2981639da8abf4f917e8c060c,2020-07,Wiltshire Police,Wiltshire Police,-1.783661,51.572382,On or near KITCHENER STREET,E01015511,Swindon 010D,Suspect charged
53c7aec59550951a809f114d5a02c6e8cc0a35ef1e7b23b4e7cb705fa207174d,2020-07,Wiltshire Police,Wiltshire Police,-1.813813,51.072951,On or near LONGLAND,E01032002,Wiltshire 055B,Investigation complete; no suspect identified
e1f46a2a8cbb6141b4f54bc86eef1b2236c7cb64f39ae679e34c8adbd2e3c84f,2020-07,Wiltshire Police,Wiltshire Police,-1.783767,51.562051,On or near Supermarket,E01032714,Swindon 019E,Investigation complete; no suspect identified
090e427eaa781535f8d944c43828427462867f4f3a6b33d226fbd36a73483217,2020-07,Wiltshire Police,Wiltshire Police,-1.805112,51.597226,On or near Supermarket,E01032710,Swindon 028E,Investigation complete; no suspect identified
22ffee381815a1bd29b21f6560b046b1ce66af9138b0c25c8fb213b19d4d5ffc,2020-07,Wiltshire Police,Wiltshire Police,-1.810567,51.597622,On or near MAZUREK WAY,E01032710,Swindon 028E,Investigation complete; no suspect identified
4d67507891a28bc08d004fa01982e5c952f8cb7c42c76add3be30ce98879c393,2020-07,Wiltshire Police,Wiltshire Police,-1.766627,51.175034,On or near ANNETTS CLOSE,E01031975,Wiltshire 048B,Investigation complete; no suspect identified
f8b9423165733999397dd260c2cd829c0b9d80bea3a50fd61763caa464a072c2,2020-07,Wiltshire Police,Wiltshire Police,-1.816525,51.602244,On or near DELFT CRESCENT,E01032711,Swindon 027D,Investigation complete; no suspect identified
00966aa441faae42f4269d37b961e62186ab38e21b2059e0b780495215e09232,2020-07,Wiltshire Police,Wiltshire Police,-1.759731,51.565259,On or near SACKVILLE CLOSE,E01015575,Swindon 016D,Investigation complete; no suspect identified
1c1bd341fc87c7a7e92ef5011023950d290ec3b159fd34c1afdece5cbc278693,2020-07,Wiltshire Police,Wiltshire Police,-1.759731,51.565259,On or near SACKVILLE CLOSE,E01015575,Swindon 016D,Investigation complete; no suspect identified
9655ee77efd0bf5444f8a22b6a549dc0b5aa61c1a0cc6c5634bae2bb523086c4,2020-07,Wiltshire Police,Wiltshire Police,-1.823502,51.073541,On or near HADRIANS CLOSE,E01032001,Wiltshire 055A,Investigation complete; no suspect identified
b0f4f4ededd3daa7f7b569fc20c96e80927d79416fbc80a6060a089ab9596144,2020-07,Wiltshire Police,Wiltshire Police,-1.830268,51.599225,On or near POSEIDON CLOSE,E01032705,Swindon 026D,Unable to prosecute suspect
63ad91d2f3f75dd6e16f7f7864de7d45562ed78f2c7484802c0d75f5dcebb436,2020-07,Wiltshire Police,Wiltshire Police,-1.807159,51.563629,On or near RAYBROOK CRESCENT,E01015579,Swindon 012C,Suspect charged
679df967fd3850632f271d1339abaed88fb28f14e813f7ad9d201e922f891e11,2020-07,Wiltshire Police,Wiltshire Police,-1.796756,51.076249,On or near Pedestrian Subway,E01032020,Wiltshire 053C,Unable to prosecute suspect
d9e3dfe0e977ef74037b55f9f0af98a0972ae188a39ede174f0b50e45faf2cf5,2020-07,Wiltshire Police,Wiltshire Police,-2.004641,51.439363,On or near Supermarket,E01031896,Wiltshire 015B,Unable to prosecute suspect
d5e3041af4eb696176edecf57328d94a9d5b1a58eaefd45f300abbde08b199ec,2020-07,Wiltshire Police,Wiltshire Police,-1.747828,51.583738,On or near FRANK WARMAN COURT,E01015553,Swindon 009E,Unable to prosecute suspect
76532400eca004deb75c4ac6d64da20e54817d41cd5fab6eb90a11c879807dbd,2020-07,Wiltshire Police,Wiltshire Police,-1.786799,51.561544,On or near QUEEN STREET,E01015476,Swindon 015B,Investigation complete; no suspect identified
49bcb408d3b6058bf712212b59240bdd30d0e369e9d4f395ca5fc03be2ef45d0,2020-07,Wiltshire Police,Wiltshire Police,-1.783295,51.564325,On or near NEW BRIDGE CLOSE,E01015475,Swindon 015A,Suspect charged
6866cf559bdcc3bfe700e26efc11d1a8845e629ba299464abf56f1885c312d80,2020-07,Wiltshire Police,Wiltshire Police,-1.788906,51.561323,On or near VILLETT STREET,E01015476,Swindon 015B,Investigation complete; no suspect identified
5b11e5bf6304564184cc62042bfe6271444f769ff45504959fe25ec6c5b295e3,2020-07,Wiltshire Police,Wiltshire Police,-1.793182,51.521750,On or near KINGSWOOD,E01015587,Swindon 025E,Unable to prosecute suspect
3125f3080c515956b1455d8bae2fc687b3aa74d0b89e1cf1a892c084dca39102,2020-07,Wiltshire Police,Wiltshire Police,-2.216897,51.321632,On or near INNOX MILL CLOSE,E01032085,Wiltshire 031A,Investigation complete; no suspect identified
72c0f5cfedeb31d8c0e21a0fef5342ef980d7701509adf8d30ddafac5cac53dd,2020-07,Wiltshire Police,Wiltshire Police,-1.807467,51.586315,On or near BOSCOMBE ROAD,E01015528,Swindon 006B,Unable to prosecute suspect
238724d563b32cc591e4878f8fde1bb932341bc999d1e471edcb419e81a0a4fe,2020-07,Wiltshire Police,Wiltshire Police,-2.201399,51.311904,On or near CLOTH YARD,E01032093,Wiltshire 035B,Unable to prosecute suspect
789cfadccd9c5c10d062f15e44554e04cd743cbed713f042167559942b24faf3,2020-07,Wiltshire Police,Wiltshire Police,-1.806739,51.563961,On or near DREW STREET,E01015579,Swindon 012C,Unable to prosecute suspect
3241dcd445911615f294265dced930aa4f809384944fc1790c542367c34b64be,2020-07,Wiltshire Police,Wiltshire Police,-1.859133,51.156811,On or near A360,E01032027,Wiltshire 054C,Investigation complete; no suspect identified
d50bd0ee0f951e2e0a78633a20ac42f1245d89c35b964ffb87f513d65102ea60,2020-07,Wiltshire Police,Wiltshire Police,-1.751645,51.553329,On or near HORHAM CRESCENT,E01015541,Swindon 020D,Suspect charged
758a9604335621a9d7368c2c0f8ab0422780867057a46c19a89b7f0f83494cc9,2020-07,Wiltshire Police,Wiltshire Police,-2.135580,51.464137,On or near PATCHWAY,E01031925,Wiltshire 010E,Unable to prosecute suspect
14080fcd676dda53be5b24eaeba0c4d0109ea6f36fffd4efb47d373ff58f48f9,2020-07,Wiltshire Police,Wiltshire Police,-2.204629,51.202701,On or near SAXONS ACRE,E01032110,Wiltshire 043A,Offender given a caution
2ef194e43b2f2bcb584326e4a17322a48f10b57215d854b5643eaffb6a87623e,2020-07,Wiltshire Police,Wiltshire Police,-1.656262,51.237094,On or near CONNAUGHT ROAD,E01031880,Wiltshire 041E,Unable to prosecute suspect
bca429c7521c6dacceda36067033dadd8ce73805be3b467edacce4709d315c6c,2020-07,Wiltshire Police,Wiltshire Police,-1.727707,51.538152,On or near Hospital,E01015547,Swindon 008C,Suspect charged
e4677d5f61c866428346ac3bd3f7e578dfd1830eb7a8e47af301dd2f1f2d7dd4,2020-07,Wiltshire Police,Wiltshire Police,-1.760817,51.559111,On or near DUDLEY ROAD,E01015573,Swindon 016C,Suspect charged
024245d88fbb3d8a28f64b7c879a9c44c18df35f1a50c58eff8a61722f98177a,2020-07,Wiltshire Police,Wiltshire Police,-2.109888,51.447683,On or near MASSEY CLOSE,E01031924,Wiltshire 014E,Unable to prosecute suspect
1284a3e706869fcf46f6a87462692d0d2fa33eddc8108e1a7abdf3ded0b503f5,2020-07,Wiltshire Police,Wiltshire Police,-1.780792,51.562738,On or near Pedestrian Subway,E01015475,Swindon 015A,Suspect charged
1284a3e706869fcf46f6a87462692d0d2fa33eddc8108e1a7abdf3ded0b503f5,2020-07,Wiltshire Police,Wiltshire Police,-1.780792,51.562738,On or near Pedestrian Subway,E01015475,Swindon 015A,Suspect charged
5e4e094647e5691ac63939c61dfdfdf277db5ccd7ade298acf2e9eb573140d8d,2020-07,Wiltshire Police,Wiltshire Police,-2.185828,51.101231,On or near B3089,E01032010,Wiltshire 050A,Suspect charged
34c68fe074bdb4a831a56cf0f2344156b758d673fc27760582483326b142ed47,2020-07,Wiltshire Police,Wiltshire Police,-1.785975,51.592742,On or near DOWNTON ROAD,E01015546,Swindon 003D,Suspect charged
0f3ae7d244833bbda2d816af47d33c02973c5db356a51f52522b009a9af4d341,2020-07,Wiltshire Police,Wiltshire Police,-1.748246,51.544636,On or near THE BIRCHES,E01015535,Swindon 024C,Suspect charged
73614929fb1d62da06b2d19b808c8aa4025a4ff6662ab238bd8c3385c7defce2,2020-07,Wiltshire Police,Wiltshire Police,-1.754843,51.556779,On or near HELSTON ROAD,E01015540,Swindon 020C,Suspect charged
404b2ddb54853b9d293235833011e60d2c3211d43ab3351e411e606c0975e97a,2020-07,Wiltshire Police,Wiltshire Police,-2.213415,51.304068,On or near KINGSDOWN ROAD,E01032088,Wiltshire 036A,Suspect charged
cfe01daf0a8b59f47cb82a0cb0f795bca6865e097b5198c5aae5c0f015ea12a2,2020-07,Wiltshire Police,Wiltshire Police,-2.190520,51.293624,On or near WEST ASHTON ROAD,E01032053,Wiltshire 037A,Offender given a caution
3880546d1b4c9793fad76928a287e8d75e6722e04e98ad7734ba80afd2d8f936,2020-07,Wiltshire Police,Wiltshire Police,-1.966725,51.367758,On or near Hospital,E01031844,Wiltshire 034A,Investigation complete; no suspect identified
3845b09cb2879df2872bb062c8a1446573c34db06578b4cfecbb172cfb9b8646,2020-07,Wiltshire Police,Wiltshire Police,-1.899318,51.548585,On or near Sports/Recreation Area,E01031965,Wiltshire 007F,Suspect charged
8a1cd079471bfc00fc3c84f5c950d5289a9a73fab1190369af0bc61d3daa66f7,2020-07,Wiltshire Police,Wiltshire Police,-1.754128,51.563755,On or near ROGERS CLOSE,E01015572,Swindon 016B,Suspect charged
d010a0f0f8118b53f83618618023ec95ceb5cda20aaddf43a1c80e3d96548cbf,2020-07,Wiltshire Police,Wiltshire Police,-2.231936,51.310318,On or near SHERIDAN GARDENS,E01032096,Wiltshire 033A,Unable to prosecute suspect
d67dcfea58b827caf2aeb3aa8ed7e77f83e1916d19219cf648304ccc6ca74bca,2020-07,Wiltshire Police,Wiltshire Police,-1.788238,51.103741,On or near Sports/Recreation Area,E01032011,Wiltshire 057B,Suspect charged
479441a184474d8b01ca59198a45caf3e22db908bab01d074fc28ac8b737a34e,2020-07,Wiltshire Police,Wiltshire Police,-1.845733,51.547106,On or near Parking Area,E01015503,Swindon 022C,Suspect charged
c59ca678905e20150f5d6a55a76b2e5aa1de5bbac71db18a6c74ec48374d1000,2020-07,Wiltshire Police,Wiltshire Police,-2.006504,51.288510,On or near PAGNELL LANE,E01031858,Wiltshire 034C,Unable to prosecute suspect
e6ca82f604ee43fb024ff8b2b1dd976214f83f6388ebe2d7d15953a2cb572463,2020-07,Wiltshire Police,Wiltshire Police,-1.743653,50.988903,On or near MOOT CLOSE,E01031993,Wiltshire 062C,Suspect charged
e6ca82f604ee43fb024ff8b2b1dd976214f83f6388ebe2d7d15953a2cb572463,2020-07,Wiltshire Police,Wiltshire Police,-1.743653,50.988903,On or near MOOT CLOSE,E01031993,Wiltshire 062C,Suspect charged
17c73546f80917b66ea669d70e37e03817e49b5f53d153553b096fab64fdcbf6,2020-07,Wiltshire Police,Wiltshire Police,-1.796486,51.069640,On or near MINSTER STREET,E01032014,Wiltshire 056A,Suspect charged
fa71c258352c87d26c8a1d7cc7e50b69ab3c428c4c2150fae9ddc9f915394cd6,2020-07,Wiltshire Police,Wiltshire Police,-1.743653,50.988903,On or near MOOT CLOSE,E01031993,Wiltshire 062C,Unable to prosecute suspect
aca9c4742d18bf2a1ebf6dd622bd7e4f946eae0fa1c239a08994eaaf6145b54e,2020-07,Wiltshire Police,Wiltshire Police,-2.143724,51.376028,On or near BRADFORD ROAD,E01032062,Wiltshire 022A,Suspect charged
fe7643813eb7c86411e46e185b1397e221644674534e70c3e85bc5a63c7f0ef7,2020-07,Wiltshire Police,Wiltshire Police,-2.124766,51.273094,On or near PEAR TREE ORCHARD,E01032056,Wiltshire 039D,Suspect charged
fe70476e3e109ef7ab212f153e0e4b0f4dd5df04a3876ec8dcca3cbb8352408e,2020-07,Wiltshire Police,Wiltshire Police,-1.718976,51.419821,On or near REEDS GROUND,E01031861,Wiltshire 019A,Unable to prosecute suspect
7e69fba802ab95b437f91773f33286e17e53abfba525b3be5664cc62a934a864,2020-07,Wiltshire Police,Wiltshire Police,-1.541863,51.432463,On or near B4192,E01031873,Wiltshire 012C,Suspect charged
7e69fba802ab95b437f91773f33286e17e53abfba525b3be5664cc62a934a864,2020-07,Wiltshire Police,Wiltshire Police,-1.541863,51.432463,On or near B4192,E01031873,Wiltshire 012C,Suspect charged
7e69fba802ab95b437f91773f33286e17e53abfba525b3be5664cc62a934a864,2020-07,Wiltshire Police,Wiltshire Police,-1.541863,51.432463,On or near B4192,E01031873,Wiltshire 012C,Suspect charged
7e69fba802ab95b437f91773f33286e17e53abfba525b3be5664cc62a934a864,2020-07,Wiltshire Police,Wiltshire Police,-1.541863,51.432463,On or near B4192,E01031873,Wiltshire 012C,Suspect charged
7e69fba802ab95b437f91773f33286e17e53abfba525b3be5664cc62a934a864,2020-07,Wiltshire Police,Wiltshire Police,-1.541863,51.432463,On or near B4192,E01031873,Wiltshire 012C,Suspect charged
224aad661d965c81d85ac02d516ce475811a65ed0ff655d3e0e11ef6dbdf5061,2020-07,Wiltshire Police,Wiltshire Police,-2.120996,51.354869,On or near BLENHEIM PARK,E01032072,Wiltshire 021F,Suspect charged
224aad661d965c81d85ac02d516ce475811a65ed0ff655d3e0e11ef6dbdf5061,2020-07,Wiltshire Police,Wiltshire Police,-2.120996,51.354869,On or near BLENHEIM PARK,E01032072,Wiltshire 021F,Suspect charged
6d76d4f673ce3f93d0af8bec98d57b01d4143e89df767a97a13ad7ed0679d5ff,2020-07,Wiltshire Police,Wiltshire Police,-1.763395,51.169273,On or near TANNERS FIELD,E01031978,Wiltshire 048E,Unable to prosecute suspect
f040fd6e7f1430a92fc068a7629e306521c1ed01cb28cc70d447bf2ecf97f4b6,2020-07,Wiltshire Police,Wiltshire Police,-1.733817,51.553550,On or near KENNEDY DRIVE,E01015491,Swindon 023E,Suspect charged
437a9acd003cac19df3a1444caf52bc3bff2068376d8d68f91cae0ac5e9928d0,2020-07,Wiltshire Police,Wiltshire Police,-2.211836,51.319465,On or near Petrol Station,E01032086,Wiltshire 031B,Offender given a caution
1f26315890e142874e589dc7fe2cd396a1bd591e1b92cbf7080442b7d3b27f37,2020-07,Wiltshire Police,Wiltshire Police,-2.190007,51.322065,On or near FERRIS WAY,E01032100,Wiltshire 032B,Unable to prosecute suspect
206c5e45e5d64bf2617ffdc500fd356bc54f70ad53dc288113f77640b650f8d8,2020-07,Wiltshire Police,Wiltshire Police,-1.811090,51.589764,On or near BROOKDENE,E01015515,Swindon 004C,Unable to prosecute suspect
069a72eac0a932815ce80e6a118a762219cb9356a2d85bfbeda6619f34644b16,2020-07,Wiltshire Police,Wiltshire Police,-1.768378,51.550054,On or near LAKESIDE,E01015534,Swindon 024B,Suspect charged
11f2a7903767c2ef5929cb4b8345615a6a1989ef23c0636f402f299812a0046d,2020-07,Wiltshire Police,Wiltshire Police,-2.183746,51.260221,On or near Supermarket,E01032119,Wiltshire 040E,Local resolution
37546fddc2cd1de8b5aeed2d6fcefb779d81d0e377f131d8e77fd5b1743c2376,2020-07,Wiltshire Police,Wiltshire Police,-1.787448,51.552374,On or near KINGSHILL ROAD,E01032707,Swindon 021F,Unable to prosecute suspect
f872c2dca0438a6fda829ca589a7bb12d84e4c255d937036aa6c4b6f6c2906db,2020-07,Wiltshire Police,Wiltshire Police,-1.779354,51.561746,On or near SPRING CLOSE,E01032714,Swindon 019E,Unable to prosecute suspect
05ac848858b4b7fbea82230174c2e4dcf576a2a8313ef28da775565d1e1994b4,2020-07,Wiltshire Police,Wiltshire Police,-1.753778,51.561749,On or near HUNSDON CLOSE,E01015572,Swindon 016B,Unable to prosecute suspect
0f0f731090da3afb7b91200fd072b619a83de2c0e9b6382d25f406780004718c,2020-07,Wiltshire Police,Wiltshire Police,-1.763268,51.562101,On or near BEAUMONT ROAD,E01015573,Swindon 016C,Suspect charged
16f79b440ceaa66989712faf78af105aeb0cee746abe5579abe92de53bd7abfa,2020-07,Wiltshire Police,Wiltshire Police,-2.000310,51.354779,On or near AVON TERRACE,E01031854,Wiltshire 026B,Suspect charged
0b6493fec97d788d373de84cc3b9008f1ad2e4671a86dc26b226b4ed4263cdb6,2020-07,Wiltshire Police,Wiltshire Police,-2.278979,51.331454,On or near BOSWELL ROAD,E01032061,Wiltshire 023D,Unable to prosecute suspect
79844d3bc16482204752d5b03d5de2c0c8c0afbb9bb4ae152840b21cc7fc9eeb,2020-07,Wiltshire Police,Wiltshire Police,-1.781936,51.592087,On or near SHERSTON AVENUE,E01015546,Swindon 003D,Suspect charged
68668f5d26f1d59875226dbf88c0c3f6f4dfbed25746c77af6ad468e0611a7f9,2020-07,Wiltshire Police,Wiltshire Police,-1.779385,51.561350,On or near Parking Area,E01032714,Swindon 019E,Unable to prosecute suspect
5752393c82cb9c93aada6f513b3c1ff4d46aa38b933b1cb8c4c7309df01038bf,2020-07,Wiltshire Police,Wiltshire Police,-2.223820,51.305254,On or near SPRING MEADOWS,E01032091,Wiltshire 036D,Unable to prosecute suspect
1283508e4d5c43cec01a65182dd1c3b9e2d1c606ae9339bb9d39fe0755312b38,2020-07,Wiltshire Police,Wiltshire Police,-1.796257,51.594990,On or near ELSTREE WAY,E01015518,Swindon 028D,Unable to prosecute suspect
64038a66be760d07d507fa98bf176b9d63b8ad56f0ab88f4147f6921f568e938,2020-07,Wiltshire Police,Wiltshire Police,-1.906427,51.542207,On or near WOOD STREET,E01031967,Wiltshire 006C,Unable to prosecute suspect
12a7ecce3a135d9fb2d679cce3a3abdc77a1babc85ac28534ebc674bbf8e90f7,2020-07,Wiltshire Police,Wiltshire Police,-1.792618,51.056729,On or near Petrol Station,E01032005,Wiltshire 059A,Investigation complete; no suspect identified
ef9b2b3f406fcc17db6ab281bda0217e4e9325393085e4c541390d7cfad705e3,2020-07,Wiltshire Police,Wiltshire Police,-1.979472,51.355523,On or near ANSTIE CLOSE,E01031850,Wiltshire 025A,Offender given a caution
768bf628d5ca04a868a11b73dc5250845f2aee8e3a79c3a6006dc2f8d8746797,2020-07,Wiltshire Police,Wiltshire Police,-2.177774,51.205505,On or near STATION ROAD,E01032103,Wiltshire 044A,Investigation complete; no suspect identified
71a3de4bafb200f3ac833cd87d6eb8d5e0c2867d4501530e88a846a9241d2268,2020-07,Wiltshire Police,Wiltshire Police,-2.141962,51.456460,On or near CARNARVON CLOSE,E01031909,Wiltshire 010D,Investigation complete; no suspect identified
6c7458a3061081cdbdc1ec2f24fd7c4643f8afc76cfae3b90903fe5ee15e3365,2020-07,Wiltshire Police,Wiltshire Police,-1.881906,51.573052,On or near LYDIARD GREEN,E01031962,Wiltshire 003D,Investigation complete; no suspect identified
88dccbaf292a6a97988870015dba34f4068edc0b3dd4d9d29d6448bb4fb130a3,2020-07,Wiltshire Police,Wiltshire Police,-2.180576,51.204566,On or near Shopping Area,E01032103,Wiltshire 044A,Investigation complete; no suspect identified
149d691433561c0074dd576092b2ba77f351b2e96978cb4a29dd5e38be4dc218,2020-07,Wiltshire Police,Wiltshire Police,-1.740432,51.549483,On or near OVERBROOK,E01015487,Swindon 023A,Investigation complete; no suspect identified
97bc7b4c04554e45a1a4f1fe69675010ebfb08f3f264b55d0935e722131825d6,2020-07,Wiltshire Police,Wiltshire Police,-1.789058,51.559669,On or near COMMERCIAL ROAD,E01015476,Swindon 015B,Investigation complete; no suspect identified
faa6bcc72d2e3efa7c2ba31a9b951a8cd14f9b731eec933ae6c91f1e42f0f589,2020-07,Wiltshire Police,Wiltshire Police,-1.759025,50.994654,On or near Petrol Station,E01031995,Wiltshire 062E,Investigation complete; no suspect identified
2f695b75cd08f21c18ebe00504fa2ddf9f06c8f577db09c8dcd2c4ca13e717ed,2020-07,Wiltshire Police,Wiltshire Police,-1.788725,51.100199,On or near LAFRANC CLOSE,E01032011,Wiltshire 057B,Investigation complete; no suspect identified
329808549315dd337515a707f6c1e3a2eca0c88096cb20f3a38d538bf3a77e23,2020-07,Wiltshire Police,Wiltshire Police,-2.194618,51.258953,On or near QUEEN'S ROAD,E01032117,Wiltshire 040C,Investigation complete; no suspect identified
f960fd1830c1f27e5ee884621d7bbe2f1176685323f52ae9ecec05b9b9c14539,2020-07,Wiltshire Police,Wiltshire Police,-1.763030,51.549531,On or near DENBIGH CLOSE,E01015533,Swindon 024A,Investigation complete; no suspect identified
dc94578f94477bdaf7ab17da304bc08be9e0543a179e2f86e0313f142ee79edb,2020-07,Wiltshire Police,Wiltshire Police,-1.898003,51.543719,On or near THE ROSARY,E01031963,Wiltshire 006A,Investigation complete; no suspect identified
de47feaba864e551ca5ca7f85c8bebdff8d0bed5522ccb0d9fca310c15d31129,2020-07,Wiltshire Police,Wiltshire Police,-1.776678,51.572270,On or near Supermarket,E01015510,Swindon 010C,Investigation complete; no suspect identified
40c1c32b3d18604e1a5433174d233c8816772da89690675f2b7846088ad09214,2020-07,Wiltshire Police,Wiltshire Police,-1.816732,51.554320,On or near MARKENFIELD,E01015568,Swindon 014D,Investigation complete; no suspect identified
22f1ef59d7669471fea8576328b7f6ccf87d2e06e3a2b594123a74699d2d2c12,2020-07,Wiltshire Police,Wiltshire Police,-1.818972,51.074874,On or near Petrol Station,E01032001,Wiltshire 055A,Investigation complete; no suspect identified
f6c7ae332a0841b5fdb1450f9d66205639e27b2d1d363c3deff8967f88abcd23,2020-07,Wiltshire Police,Wiltshire Police,-1.881906,51.573052,On or near LYDIARD GREEN,E01031962,Wiltshire 003D,Investigation complete; no suspect identified
62135fe281220491ddcb08a3a9511d8e70d5802fb5c479140362dba2c62d4bfa,2020-07,Wiltshire Police,Wiltshire Police,-2.001534,51.439228,On or near GRIERSON CLOSE,E01031896,Wiltshire 015B,Investigation complete; no suspect identified
c5d06a46fe8ef2fe5f238e183b3419387ed9fdba9213252db6db5302f5554984,2020-07,Wiltshire Police,Wiltshire Police,-1.818972,51.074874,On or near Petrol Station,E01032001,Wiltshire 055A,Investigation complete; no suspect identified
df92a7db2998a861e49463c18cf7eb30115b8309529a38f763fd8360a10ce066,2020-07,Wiltshire Police,Wiltshire Police,-2.128534,51.369697,On or near RUTLAND CLOSE,E01032066,Wiltshire 022B,Unable to prosecute suspect
8e34975b1c1201c87eec988e230737789e08f4784679db1a20349a0cab037bf3,2020-07,Wiltshire Police,Wiltshire Police,-2.128534,51.369697,On or near RUTLAND CLOSE,E01032066,Wiltshire 022B,Unable to prosecute suspect
bd8a19845587c41e08e20c1b69d71bee2b463c76ac38d4fb507499402d5145ae,2020-07,Wiltshire Police,Wiltshire Police,-1.836356,51.552146,On or near CRAWFORD CLOSE,E01015502,Swindon 022B,Investigation complete; no suspect identified
8cf68a82937750cb024afcb695dcf1f14c1843c4c3b13c68aff1bab707873dfa,2020-07,Wiltshire Police,Wiltshire Police,-1.980119,51.285919,On or near NEW STREET,E01031858,Wiltshire 034C,Unable to prosecute suspect
a0fc4c2a17e97c8976fa9416b2ec5aea0d31e04cb6b88c1a727ccd1ca1fd5933,2020-07,Wiltshire Police,Wiltshire Police,-1.751207,51.554272,On or near WHITBOURNE AVENUE,E01015540,Swindon 020C,Unable to prosecute suspect
cadb30de3acef83282581415aebc5ec55da9ccd725449c77ea062996e3f023b1,2020-07,Wiltshire Police,Wiltshire Police,-2.209221,51.321844,On or near MANVERS STREET,E01032086,Wiltshire 031B,Investigation complete; no suspect identified
9265c3f847ac6059b9ba8d511fae2916fe22e105873712b4a86794eea7a77416,2020-07,Wiltshire Police,Wiltshire Police,-1.798104,51.562589,On or near Shopping Area,E01032716,Swindon 012G,Investigation complete; no suspect identified
f4de57f415b15d4c8571c63bd0b117de51c356234dc80a254f5a25113e716ab2,2020-07,Wiltshire Police,Wiltshire Police,-1.747775,51.588063,On or near Hospital,E01015552,Swindon 009D,Investigation complete; no suspect identified
8a4682803e4a5962355a6753373c614dece549e479397ee594de9d39b81d2e0d,2020-07,Wiltshire Police,Wiltshire Police,-2.146327,51.448892,On or near Petrol Station,E01031906,Wiltshire 010B,Investigation complete; no suspect identified
8fba48ab089b6aa0b355aa9773450d547311e618e67bc379a2494b837d6057f4,2020-07,Wiltshire Police,Wiltshire Police,-1.867637,51.642180,On or near Sports/Recreation Area,E01031934,Wiltshire 001B,Investigation complete; no suspect identified
3cc314d414762a0c12a391c12333cb3dbba1f4ebbade9e7c64395202570877a9,2020-07,Wiltshire Police,Wiltshire Police,-1.829879,51.082363,On or near WINDING WAY,E01031981,Wiltshire 052B,Investigation complete; no suspect identified
462c094aeb0422407243e35ac1ebb845f948d65ff318aa45ae5b8a19786fbf16,2020-07,Wiltshire Police,Wiltshire Police,-1.796714,51.072940,On or near MILL STREAM APPROACH,E01032014,Wiltshire 056A,Investigation complete; no suspect identified
7af4cb12bbdc4fb670c353d05cbee5321d9bd21bf12b45b7feaaafe38ddb1d7a,2020-07,Wiltshire Police,Wiltshire Police,-1.784955,51.561001,On or near Shopping Area,E01015494,Swindon 019A,Suspect charged
813e372fc9a53cf3bd3f5e67971f452b0ef4ad55dea2bf438c3ea1bf285f928e,2020-07,Wiltshire Police,Wiltshire Police,-1.993247,51.439453,On or near HERON CLOSE,E01031902,Wiltshire 016C,Investigation complete; no suspect identified
40a77c8157c31e7d1aba494df367351d09309dab11a2e78b957db2a232d00390,2020-07,Wiltshire Police,Wiltshire Police,-1.785196,51.561954,On or near Shopping Area,E01015476,Swindon 015B,Investigation complete; no suspect identified
a9006b4c0d05d90680e4bb8bca67bc203d7b92f49d7216bde5266821a9af177a,2020-07,Wiltshire Police,Wiltshire Police,-1.749656,51.553198,On or near ROYSTON ROAD,E01015541,Swindon 020D,Investigation complete; no suspect identified
78774ed15d7aad4450855e0c060ff381465f458cdce03d6ceba36832f4d2cdef,2020-07,Wiltshire Police,Wiltshire Police,-1.733072,51.564995,On or near TERNCLIFF,E01015486,Swindon 013F,Unable to prosecute suspect
