Crime ID,Month,Reported by,Falls within,Longitude,Latitude,Location,LSOA code,LSOA name,Outcome type
0d4d6c29f17312db3e84726339683a38cf42835ebafc5ff306b2756514d892a7,2020-07,Wiltshire Police,Wiltshire Police,-2.205043,51.321348,On or near Shopping Area,E01032101,Wiltshire 032C,Investigation complete; no suspect identified
0bdc647b731723e2c04791bcb6d8a926b3c9ad3220a5a27a9e7b4465b1594cfe,2020-07,Wiltshire Police,Wiltshire Police,-1.747740,50.986691,On or near SQUAREY CLOSE,E01031993,Wiltshire 062C,Investigation complete; no suspect identified
e83fdfad79913d802823c73dabe40f67d9627655c24e718128352ae83f4d6dc3,2020-07,Wiltshire Police,Wiltshire Police,-1.754843,51.556779,On or near HELSTON ROAD,E01015540,Swindon 020C,Suspect charged
b6d7ccc4ddb53499baf7ea77737f4f4e224cbacc111d56ad54997cfdbcd8f11e,2020-07,Wiltshire Police,Wiltshire Police,-1.780551,51.588992,On or near STOCKTON ROAD,E01015544,Swindon 003B,Unable to prosecute suspect
a6e432bd0d776b9aa45075b8e3e144966429248e9b8c2797bc7b919722fa5bec,2020-07,Wiltshire Police,Wiltshire Police,-1.714560,51.630039,On or near COPPER BEECHES,E01015520,Swindon 001B,Investigation complete; no suspect identified
8e3760bcb5e3d43cbcca0cadf9449b0df56b7dc8a543eb697fb6e55643f734d0,2020-07,Wiltshire Police,Wiltshire Police,-1.819395,51.072789,On or near CECIL TERRACE,E01032001,Wiltshire 055A,Investigation complete; no suspect identified
a2f38d3bc7aea744b9040fb93b806d553198982cf047f23e862176720c9f37a3,2020-07,Wiltshire Police,Wiltshire Police,-1.743653,50.988903,On or near MOOT CLOSE,E01031993,Wiltshire 062C,Investigation complete; no suspect identified
c1c7da22c4a65bf84e4f25ad5a0b568885b7159380701b9c6339e96cd8d6a4d4,2020-07,Wiltshire Police,Wiltshire Police,-1.785196,51.561954,On or near Shopping Area,E01015476,Swindon 015B,Investigation complete; no suspect identified
4657f253dec15dc19305b37c02cb6fd89fb467f3ecfbf6dfeed9f8eecf3003e5,2020-07,Wiltshire Police,Wiltshire Police,-1.785196,51.561954,On or near Shopping Area,E01015476,Swindon 015B,Investigation complete; no suspect identified
ca08b76501469c7b381e9ab9e1e9a1efc96a88bf6ad0f8adfe7c045dcc8646e0,2020-07,Wiltshire Police,Wiltshire Police,-2.152790,51.539662,On or near LATIMER GARDENS,E01031960,Wiltshire 005D,Investigation complete; no suspect identified
911d6232c4cf97733d7b6a56197ab1f94a55ddbde54f0ad39d0566d32fd5e907,2020-07,Wiltshire Police,Wiltshire Police,-2.198058,51.295625,On or near WESTBURY ROAD,E01032052,Wiltshire 039A,Investigation complete; no suspect identified
daef8cba6856fe47fa6c942d986c35dc9625ee491bb41872baa9bb09e2be290d,2020-07,Wiltshire Police,Wiltshire Police,-2.077045,51.350392,On or near COOKS CLOSE,E01031876,Wiltshire 028E,Investigation complete; no suspect identified
faf55fff4c8e1e8420af940e6d0313c7feb9dcc2c9066192132a7fb790845f94,2020-07,Wiltshire Police,Wiltshire Police,-2.157126,51.534405,On or near THE PARKLANDS,E01031958,Wiltshire 005B,Investigation complete; no suspect identified
01b82907b6e28c72cd19d181ea27f449d5e1c8c2a9af1da6ed0cd023d18b0011,2020-07,Wiltshire Police,Wiltshire Police,-2.124766,51.273094,On or near PEAR TREE ORCHARD,E01032056,Wiltshire 039D,Unable to prosecute suspect
14a5ba015bd8f0e96fd1025014b0ba684291160ccd0927fc2fed78911cd27029,2020-07,Wiltshire Police,Wiltshire Police,-1.826750,51.605505,On or near FAWLEY CLOSE,E01032713,Swindon 026F,Unable to prosecute suspect
af720dd98baf6975dcd2c41c5b85d74306f21fa7660c47a7d98834a39216b73a,2020-07,Wiltshire Police,Wiltshire Police,-1.994250,51.353088,On or near Parking Area,E01031854,Wiltshire 026B,Investigation complete; no suspect identified
71d470919a5dbf0ef64a1270ffffcd0681760e19f862c4669979f053276523d3,2020-07,Wiltshire Police,Wiltshire Police,-2.077045,51.350392,On or near COOKS CLOSE,E01031876,Wiltshire 028E,Investigation complete; no suspect identified
349406f12f9a0c573653e1950a5929562693223161b5373e10d2d47fe9f4deb7,2020-07,Wiltshire Police,Wiltshire Police,-2.042377,51.283170,On or near Prison,E01031848,Wiltshire 028C,Action to be taken by another organisation
ac42e57f8f834d3259a44f7fd6eab39cb0bf8ad9dc37eccd6185a6cec058c605,2020-07,Wiltshire Police,Wiltshire Police,-2.108291,51.587222,On or near AVON ROAD,E01031949,Wiltshire 002D,Investigation complete; no suspect identified
ed2c9f677c62d07ba96785b20afe8f1b26bfe8ff03307f6b358af4b920da6b19,2020-07,Wiltshire Police,Wiltshire Police,-2.118088,51.580056,On or near FOXLEY ROAD,E01031959,Wiltshire 005C,Investigation complete; no suspect identified
8abbac42a375a7ee8dd2e42cfd6e81343e189fcdba9ba8f6934768ba5aab926d,2020-07,Wiltshire Police,Wiltshire Police,-2.135571,51.373906,On or near LOWBOURNE,E01032062,Wiltshire 022A,Investigation complete; no suspect identified
d3300fc2de981b8230174baa156b58f8525f15dac0002f11c4b2e5bfcac70e3d,2020-07,Wiltshire Police,Wiltshire Police,-2.206425,51.325598,On or near LOWER COURT,E01032087,Wiltshire 031C,Suspect charged as part of another case
60422e16322a91fe61c31213367888b328505860dd90e5c993e83d98197b75d7,2020-07,Wiltshire Police,Wiltshire Police,-1.710573,51.632116,On or near GLEBE PLACE,E01015523,Swindon 001E,Unable to prosecute suspect
2768db876afa795191a3d388d44d4814d9b8b4ab7f36adc1365b280a3118631f,2020-07,Wiltshire Police,Wiltshire Police,-1.875986,51.110602,On or near SUTTON CLOSE,E01032013,Wiltshire 049A,Investigation complete; no suspect identified
1674e1c42b75d0e7af433fd33c66ae2e3dfb31a46a51a47899541bd49f6b2b0e,2020-07,Wiltshire Police,Wiltshire Police,-2.201906,51.335830,On or near CANAL ROAD,E01032078,Wiltshire 030B,Investigation complete; no suspect identified
13d4c4ce6e32e78083287f2c4fc7c63e31bda9f444495207c9b17874f38e10b0,2020-07,Wiltshire Police,Wiltshire Police,-1.779796,51.592722,On or near EVERLEIGH ROAD,E01015544,Swindon 003B,Investigation complete; no suspect identified
7ae31f2d86a51789a41dbe55d839f8972f5309316a87c9655ebb0bab736d2203,2020-07,Wiltshire Police,Wiltshire Police,-1.727707,51.538152,On or near Hospital,E01015547,Swindon 008C,Suspect charged
4a72e78e808f9802a78fde44175bc72727ab43c958f7c434daaaa8ddea8a39ea,2020-07,Wiltshire Police,Wiltshire Police,-2.227571,51.309518,On or near MANOR ROAD,E01032096,Wiltshire 033A,Offender given a drugs possession warning
e68d4526d84fdc490047dc2d23521f91748e2bfa91f21397dc49353d8de29bbd,2020-07,Wiltshire Police,Wiltshire Police,-1.983050,51.351586,On or near LONGCROFT AVENUE,E01031851,Wiltshire 025B,Investigation complete; no suspect identified
570280c14da93b993dc3fda71a8e5145fa3037462ed03f4a1da80d4cd65b5473,2020-07,Wiltshire Police,Wiltshire Police,-1.983050,51.351586,On or near LONGCROFT AVENUE,E01031851,Wiltshire 025B,Investigation complete; no suspect identified
0a2efda2b5d24f15487ac33406e1445fd9401e5cd34734e3ad41baa775911e3b,2020-07,Wiltshire Police,Wiltshire Police,-1.835455,51.549933,On or near TURNHAM GREEN,E01015501,Swindon 022A,Unable to prosecute suspect
5e6770735811690fae5208b5b6ae130a9462942b17f093180b4788afa6665252,2020-07,Wiltshire Police,Wiltshire Police,-1.828438,51.078269,On or near PEMBROKE ROAD,E01031983,Wiltshire 052D,Investigation complete; no suspect identified
fa71058041974a47e53aabee424f42d76a73d3b9f9847279b6bdc2c3ca57bd36,2020-07,Wiltshire Police,Wiltshire Police,-2.227446,51.321963,On or near LYNWOOD DRIVE,E01032097,Wiltshire 033B,Investigation complete; no suspect identified
6b2b72c363b84abfb68d05d791ec93865b8abece5af72259391166c01bf37e34,2020-07,Wiltshire Police,Wiltshire Police,-2.137527,51.455818,On or near PORTWAY,E01031928,Wiltshire 011F,Investigation complete; no suspect identified
f075744671c6614edec939ee6330de5c86376b8e87686dd71480a72caf41b191,2020-07,Wiltshire Police,Wiltshire Police,-2.137527,51.455818,On or near PORTWAY,E01031928,Wiltshire 011F,Investigation complete; no suspect identified
abbd2dd0cf4ccf11dd25ff00b252ec9f6913596d23d938d76da6a33e9ff80a69,2020-07,Wiltshire Police,Wiltshire Police,-1.805925,51.602910,On or near DYRHAM COURT,E01032711,Swindon 027D,Unable to prosecute suspect
b0e0d2a9e0832e630ec6d3a80c3f2e7b1db7d75eb46baf7ebfa60d7d3ce1c3e9,2020-07,Wiltshire Police,Wiltshire Police,-1.718976,51.419821,On or near REEDS GROUND,E01031861,Wiltshire 019A,Suspect charged
047dc8234f297be112f89c799c186d6a99ed9338204e18727e61108e1b126573,2020-07,Wiltshire Police,Wiltshire Police,-2.181632,51.203836,On or near Parking Area,E01032103,Wiltshire 044A,Investigation complete; no suspect identified
b1aae7223fd4e6385f99ca60a939e60cf7b40da3b3f92e23f64d9edadfa6ab8a,2020-07,Wiltshire Police,Wiltshire Police,-2.137514,51.370307,On or near Parking Area,E01032068,Wiltshire 022D,Unable to prosecute suspect
f00d8d0f0f18d19e5ebc75e3ff3590c885f1406957cb55c0532b7d9a3c967f88,2020-07,Wiltshire Police,Wiltshire Police,-1.966725,51.367758,On or near Hospital,E01031844,Wiltshire 034A,Investigation complete; no suspect identified
72bc175b12b49f6aa45ec707a7cce74e68dfd65227efde9f09db5aad840f43f4,2020-07,Wiltshire Police,Wiltshire Police,-1.784955,51.561001,On or near Shopping Area,E01015494,Swindon 019A,Investigation complete; no suspect identified
9b9630e0fccffb47e1b1c1c80a4d0381c32cf60e74a59356768e397cf68d8864,2020-07,Wiltshire Police,Wiltshire Police,-2.135103,51.463508,On or near REDLAND,E01031925,Wiltshire 010E,Investigation complete; no suspect identified
54949fa9fc05d10d1b58d50ab74837f801a9817f45c914e7860cc3a08076d660,2020-07,Wiltshire Police,Wiltshire Police,-1.812300,51.590432,On or near FRANCOMES,E01015515,Swindon 004C,Unable to prosecute suspect
3e78bde77901456e58e5ad60a4dd0fb29b1ba9f105e0171a0ddaf240bbbf8e86,2020-07,Wiltshire Police,Wiltshire Police,-1.812300,51.590432,On or near FRANCOMES,E01015515,Swindon 004C,Unable to prosecute suspect
22470e6c86cdaf849ce843cd734134cead02bc4442cddde42af5555e7e934acd,2020-07,Wiltshire Police,Wiltshire Police,-1.863021,51.055556,On or near Race Track,E01032000,Wiltshire 057A,Investigation complete; no suspect identified
2435cc544863cfa4c46232bfdad713b6461995979102c56c3159550d148473ff,2020-07,Wiltshire Police,Wiltshire Police,-1.800213,51.565281,On or near Supermarket,E01015578,Swindon 012B,Investigation complete; no suspect identified
7b229b4b3fc1d9f9fc631962b48c3cf7bed5b518858359bc99b9cfb97ed504f8,2020-07,Wiltshire Police,Wiltshire Police,-1.787448,51.552374,On or near KINGSHILL ROAD,E01032707,Swindon 021F,Investigation complete; no suspect identified
1b7657a717c7a8f467bda395022cc11d69194d6aff6400cc68cabd07423245d8,2020-07,Wiltshire Police,Wiltshire Police,-1.974888,51.360909,On or near LE MARCHANT CLOSE,E01032693,Wiltshire 025H,Investigation complete; no suspect identified
7cffbbab5ecfbbff50e2f9bb38600e758e5bdf2eb9a29838c516b170bb9f3970,2020-07,Wiltshire Police,Wiltshire Police,-1.746624,51.545882,On or near Pedestrian Subway,E01015542,Swindon 020E,Investigation complete; no suspect identified
403a7850717db37139c2d51ef10d93baa8836a57bc139719d9ac1e5c42df97c8,2020-07,Wiltshire Police,Wiltshire Police,-1.763113,51.550286,On or near CARDIGAN CLOSE,E01015533,Swindon 024A,Investigation complete; no suspect identified
841170ef6b3ea2d6d332a052e98266c95dd17f02e46a4537bf15efaefb63441b,2020-07,Wiltshire Police,Wiltshire Police,-1.813813,51.072951,On or near LONGLAND,E01032002,Wiltshire 055B,Unable to prosecute suspect
91647e489a1556b975ae8c70fbebda767db66e04c1b8cedfcc221a22864d19f5,2020-07,Wiltshire Police,Wiltshire Police,-1.983407,51.355452,On or near LONDON ROAD,E01031850,Wiltshire 025A,Unable to prosecute suspect
b994fe7a6061424e36eb2f40268a45f3d604dbd77b4d05733a80aa89a0dc0ee4,2020-07,Wiltshire Police,Wiltshire Police,-1.743390,50.992706,On or near HIGH STREET,E01031993,Wiltshire 062C,Investigation complete; no suspect identified
0dec3c83f6c209e780c213b1c2d9ee4edfffd77526f2bdaba7b4ad10afd959f4,2020-07,Wiltshire Police,Wiltshire Police,-1.730057,51.547859,On or near Supermarket,E01015488,Swindon 023B,Investigation complete; no suspect identified
800d565b36258db41f5d0937bb112128f8e5a1fdc7f5ad5431bad664194cd915,2020-07,Wiltshire Police,Wiltshire Police,-1.743390,50.992706,On or near HIGH STREET,E01031993,Wiltshire 062C,Investigation complete; no suspect identified
1a25008a6c9b05274029a48ac1cefc34e6b15d3a74e11fb5cf4ee795cebcde3c,2020-07,Wiltshire Police,Wiltshire Police,-1.813498,51.583420,On or near JUBILEE ROAD,E01015528,Swindon 006B,Unable to prosecute suspect
bd4c4a128bffba2bc25f2643b9794690a6ecb5705efcb93428ddb1f26d30f968,2020-07,Wiltshire Police,Wiltshire Police,-1.783767,51.562051,On or near Supermarket,E01032714,Swindon 019E,Investigation complete; no suspect identified
07848b696b673ebe551a24750cf6ec4e0fa917f15da565fd9af55731a1aa7e23,2020-07,Wiltshire Police,Wiltshire Police,-1.758433,51.565211,On or near HAMILTON CLOSE,E01015575,Swindon 016D,Unable to prosecute suspect
5486163158232f294ad7a6a4251df5bf97ae711524ebf6c5805c87f7ad96c21f,2020-07,Wiltshire Police,Wiltshire Police,-2.067817,51.575924,On or near CRAB MILL LANE,E01031894,Wiltshire 004D,Investigation complete; no suspect identified
5aa0b3f9f220acb49b9de4620ed25dc4e78ea85af3e2d06d4ea9f9be6121c0f7,2020-07,Wiltshire Police,Wiltshire Police,-1.837053,51.550664,On or near COTTINGTON CLOSE,E01015503,Swindon 022C,Investigation complete; no suspect identified
6d8b4bf9a955f1fa7f6eeb17d3d69a6eb0a3d289422b4f621411a79b09b76b14,2020-07,Wiltshire Police,Wiltshire Police,-1.983050,51.351586,On or near LONGCROFT AVENUE,E01031851,Wiltshire 025B,Investigation complete; no suspect identified
a809687822c7ead54c61f8045d3206b37bf39a9020ca7f9ad75ea6110e0e367e,2020-07,Wiltshire Police,Wiltshire Police,-1.784066,51.547593,On or near WESTLECOT ROAD,E01032707,Swindon 021F,Investigation complete; no suspect identified
1784f1dc96b77ef3ac62aacbb54b485ca635e32e277ee2049fa7e366f8e07113,2020-07,Wiltshire Police,Wiltshire Police,-2.000469,51.429059,On or near Sports/Recreation Area,E01031903,Wiltshire 016D,Investigation complete; no suspect identified
73ef1d568fb3a745973e79c5b1a77e2743b9ed8a5162d424b0c77dc2b4367da8,2020-07,Wiltshire Police,Wiltshire Police,-2.042377,51.283170,On or near Prison,E01031848,Wiltshire 028C,Action to be taken by another organisation
b5ec660f3a47d916b122fc0d341c93cea22ba1e5ac66ae8893d3e1c5d8dbe0c6,2020-07,Wiltshire Police,Wiltshire Police,-2.227571,51.309518,On or near MANOR ROAD,E01032096,Wiltshire 033A,Unable to prosecute suspect
8faddb3833413fbcfd4bdd940b6a6ca16c56e4506713cfcb77fdf1b9c0276ff7,2020-07,Wiltshire Police,Wiltshire Police,-1.796486,51.069640,On or near MINSTER STREET,E01032014,Wiltshire 056A,Unable to prosecute suspect
56a8b79d1bff88c5301b9da8ef38d810ccac2525de522ba72b2c8008ea9737b1,2020-07,Wiltshire Police,Wiltshire Police,-2.021455,51.640283,On or near BENDY BOW,E01031885,Wiltshire 002A,Investigation complete; no suspect identified
35030800aa7c36ede9b856228f2d5f54c264cee2306a7dd6d95b4aa73223907b,2020-07,Wiltshire Police,Wiltshire Police,-1.788117,51.554128,On or near ASHFORD ROAD,E01015497,Swindon 019D,Investigation complete; no suspect identified
c6fde02262e36f2b19a7ddd750a2650e21d05c23b9df50b353b9063701f8d1e5,2020-07,Wiltshire Police,Wiltshire Police,-1.775189,51.587399,On or near OKUS GROVE,E01015543,Swindon 003A,Investigation complete; no suspect identified
1b51678f88aca638526bc901c35f5fa3cdc4432fac08259c5823329179f0efd0,2020-07,Wiltshire Police,Wiltshire Police,-2.138730,51.373381,On or near Supermarket,E01032068,Wiltshire 022D,Investigation complete; no suspect identified
7f7d509ced1063a2b81d54d9b4e9b8dd526e27edcf9c2549cd04a6888a36b468,2020-07,Wiltshire Police,Wiltshire Police,-1.746763,51.557328,On or near FAREHAM CLOSE,E01015537,Swindon 020A,Investigation complete; no suspect identified
606d9b8571328ef00609808a122d16da340196362f6fd5e896e11518825b6b6e,2020-07,Wiltshire Police,Wiltshire Police,-1.722200,51.528509,On or near MEADOW WAY,E01015547,Swindon 008C,Investigation complete; no suspect identified
c846bd2174749d49e90591e36e5c9c4cd31b745b110a6ff52e4e3bb99905c35f,2020-07,Wiltshire Police,Wiltshire Police,-2.161211,51.200989,On or near QUEENSWAY,E01032104,Wiltshire 042A,Investigation complete; no suspect identified
948a34326e7b48b0559229e390f04d38e53d59ceb3186686e462a319d0137d0d,2020-07,Wiltshire Police,Wiltshire Police,-1.619705,51.478634,On or near GLEBE CLOSE,E01031841,Wiltshire 012A,Investigation complete; no suspect identified
a920e15435beafdf047b15e77058ba54ee3e07a894313c3139b1848050c8900a,2020-07,Wiltshire Police,Wiltshire Police,-1.743524,51.579170,On or near YIEWSLEY CRESCENT,E01015554,Swindon 009F,Investigation complete; no suspect identified
568833a974bb597cdde8aa5b403a7791bd4ff2c4e833d48c4c62939285361164,2020-07,Wiltshire Police,Wiltshire Police,-1.790886,51.070646,On or near GREENCROFT STREET,E01032014,Wiltshire 056A,Unable to prosecute suspect
b36d19c1f89bb3fd3d6370cd8e41b98243948e54a6c438ef6543c6f02e80d25c,2020-07,Wiltshire Police,Wiltshire Police,-1.790886,51.070646,On or near GREENCROFT STREET,E01032014,Wiltshire 056A,Unable to prosecute suspect
9a52062aa09306e9f59bcfc7cb11a36736c9591210abdc3d65fd6b5d5ec252b7,2020-07,Wiltshire Police,Wiltshire Police,-1.823104,51.558880,On or near THORNFORD DRIVE,E01015568,Swindon 014D,Unable to prosecute suspect
52c2939da7fd8794c89b2574d85a2f3ee0621b97ea27d520c533fc4e8be2abec,2020-07,Wiltshire Police,Wiltshire Police,-1.757498,51.559338,On or near SHREWSBURY ROAD,E01015573,Swindon 016C,Suspect charged
41255c86b1370b1e9858783cadae732b45dae5c480f49c6d723bce8d1850fcb3,2020-07,Wiltshire Police,Wiltshire Police,-1.791461,51.076186,On or near CHURCHILL WAY NORTH,E01032020,Wiltshire 053C,Offender given a drugs possession warning
2a396f5fad0990cca2caffaef72f25c2dd0a80bed089f5435b1c34c8f4acadf9,2020-07,Wiltshire Police,Wiltshire Police,-1.783295,51.564325,On or near NEW BRIDGE CLOSE,E01015475,Swindon 015A,Investigation complete; no suspect identified
756988434b9c4c22e8e041fde314ace51ce19883c4b72774525de99c3bad1512,2020-07,Wiltshire Police,Wiltshire Police,-1.782145,51.172492,On or near ABBEY LANE,E01031979,Wiltshire 048F,Unable to prosecute suspect
8dced70c05b422309cf0656d92332741b823eed22e21c6adfafafb75992807c1,2020-07,Wiltshire Police,Wiltshire Police,-1.779716,51.558599,On or near CLARENCE STREET,E01032714,Swindon 019E,Investigation complete; no suspect identified
cb4403e5531698b4ca8da2c454cd85c9ae3521125f0849d3d04810bb07ded1f4,2020-07,Wiltshire Police,Wiltshire Police,-1.776117,51.571873,On or near Parking Area,E01015510,Swindon 010C,Unable to prosecute suspect
f69317e1298fe97b838d691196f5274eecfdcad5548b191d6317a66c76d27a63,2020-07,Wiltshire Police,Wiltshire Police,-1.786285,51.594217,On or near ALLINGTON ROAD,E01015545,Swindon 003C,Investigation complete; no suspect identified
bd0f6f71991708503f0708603726d14daa43928d97cea36a8396eda33b67d1fd,2020-07,Wiltshire Police,Wiltshire Police,-2.187237,51.318437,On or near Sports/Recreation Area,E01032102,Wiltshire 032D,Unable to prosecute suspect
66063dc77523828bebd4242743efecef21a6967db307459a5ff5477f4ab66a35,2020-07,Wiltshire Police,Wiltshire Police,-1.989641,51.349959,On or near LONG STREET,E01031852,Wiltshire 025C,Suspect charged
164ac6f845702ed8dd30538da4413202837047c6b993e4d11b57821208dc4961,2020-07,Wiltshire Police,Wiltshire Police,-1.797118,51.560492,On or near RODBOURNE ROAD,E01015477,Swindon 015C,Unable to prosecute suspect
61c632c2be0d00b03e3457c3267a81800888d781ad3b19fecbfb3a3168e9b769,2020-07,Wiltshire Police,Wiltshire Police,-2.254800,51.340429,On or near SOUTHLEIGH,E01032050,Wiltshire 027F,Investigation complete; no suspect identified
e6fae158ccd70ace1c9600c7bfc2708b4797912e962ec4b10f0e0967bd1a68d7,2020-07,Wiltshire Police,Wiltshire Police,-1.792884,51.240338,On or near COURT FARM CLOSE,E01031867,Wiltshire 038B,Unable to prosecute suspect
eeb636eea8347fe90bf5ab2068e19fb598c09bb489d2e1dda56ee88fa9da9009,2020-07,Wiltshire Police,Wiltshire Police,-1.763395,51.169273,On or near TANNERS FIELD,E01031978,Wiltshire 048E,Unable to prosecute suspect
c0879ff75be56ea7b74cc2f2f66a34eae0c856365654adac67656418760276e7,2020-07,Wiltshire Police,Wiltshire Police,-1.798818,51.554471,On or near Petrol Station,E01015498,Swindon 021B,Unable to prosecute suspect
fb26e977f20106cb6db79f8affc44a13d096b6c2594fd7a8c2bbd59fb70be987,2020-07,Wiltshire Police,Wiltshire Police,-2.197924,51.261196,On or near GRYPHON CLOSE,E01032118,Wiltshire 040D,Offender given a caution
f19d2819d6c86a8f38b651ce664c6c609e3f2000c4e39da1424430182778de93,2020-07,Wiltshire Police,Wiltshire Police,-1.800555,51.582716,On or near Supermarket,E01015529,Swindon 006C,Offender given a drugs possession warning
11e62eee0728a1cad96e0fdc808e16e06ef2d332749734415fa3727e367fdea9,2020-07,Wiltshire Police,Wiltshire Police,-2.197924,51.261196,On or near GRYPHON CLOSE,E01032118,Wiltshire 040D,Offender given a caution
bcac926879b69cefb93e8951b338af4d1f87ff75826dd4f6aff78f15af5f3c9e,2020-07,Wiltshire Police,Wiltshire Police,-2.022716,51.362375,On or near DEVIZES ROAD,E01031846,Wiltshire 028B,Unable to prosecute suspect
96ed98a9092aac58ea151b30b3a4f24e7c8fc687c1346c8b9f3bbad3d113ebb8,2020-07,Wiltshire Police,Wiltshire Police,-1.778878,51.558958,On or near WELLS STREET,E01032714,Swindon 019E,Investigation complete; no suspect identified
93909c2db55224b58411244c3b2eecea2fdba16c4c12584989a7fa7e43d8b736,2020-07,Wiltshire Police,Wiltshire Police,-1.771515,51.562990,On or near A4259,E01015479,Swindon 017A,Offender given a caution
a4dc1c805a0b042e01eea2dd8b4aec588c9cd622e3e548a1a425b5816b9ac7a4,2020-07,Wiltshire Police,Wiltshire Police,-2.211449,51.322631,On or near Parking Area,E01032086,Wiltshire 031B,Investigation complete; no suspect identified
5a65cbe3a16b2e3134727f5e2417eb9e81d89818346f7a71b1434c2383cd3483,2020-07,Wiltshire Police,Wiltshire Police,-2.211449,51.322631,On or near Parking Area,E01032086,Wiltshire 031B,Investigation complete; no suspect identified
8b0e788556f16a44e99277f6218535daf6dbbbb0890156d7ea7ce39de6e598bb,2020-07,Wiltshire Police,Wiltshire Police,-1.665143,51.528711,On or near THE GALLOPS,E01015547,Swindon 008C,Investigation complete; no suspect identified
a17b1da8f79c6fd521fd78fdcf2d7a19cd79998e0ee69f52fb1e8111c908e066,2020-07,Wiltshire Police,Wiltshire Police,-1.997332,51.450036,On or near HARRIS ROAD,E01032690,Wiltshire 015F,Unable to prosecute suspect
d772561327044a308a52c852134261f7edbd605986e94eccb54b34d2ea95a8b0,2020-07,Wiltshire Police,Wiltshire Police,-1.851080,51.086447,On or near THORNTON CRESCENT,E01032039,Wiltshire 054E,Investigation complete; no suspect identified
9f4f64c2eea93897a2e4ab342152cde1f5e07b186b5a9bad9fa374cf74cfc4fe,2020-07,Wiltshire Police,Wiltshire Police,-1.817277,51.070429,On or near WHITTLE ROAD,E01032002,Wiltshire 055B,Investigation complete; no suspect identified
886bb46b3e784755bf58e455aae7bc72171c373a6db1fdee312076635341f653,2020-07,Wiltshire Police,Wiltshire Police,-1.783809,51.082449,On or near DENISON RISE,E01031986,Wiltshire 051C,Investigation complete; no suspect identified
b646c2125e449ba998a1527953f6896ac7ba82decddb9552ee085476096181c8,2020-07,Wiltshire Police,Wiltshire Police,-2.123524,51.354920,On or near BARNES WALLIS CLOSE,E01032072,Wiltshire 021F,Unable to prosecute suspect
64a4664aad980fad6e7076019161d481f2ba8e409f0801c178a5f971cfc7d70f,2020-07,Wiltshire Police,Wiltshire Police,-1.977548,51.356036,On or near PROUDMAN ROAD,E01031850,Wiltshire 025A,Investigation complete; no suspect identified
503324baf721869ee6401dff5ffc75e9334c625d8cefcad339d0812c0f4817fa,2020-07,Wiltshire Police,Wiltshire Police,-2.208614,51.305246,On or near LIDDINGTON WAY,E01032092,Wiltshire 035A,Investigation complete; no suspect identified
3c2c2fcb183b029adc4a0c198eb729381ddd166abb2bcfccbfc5df186bcbac69,2020-07,Wiltshire Police,Wiltshire Police,-2.186245,51.427804,On or near NURSERY GARDENS,E01031933,Wiltshire 018C,Investigation complete; no suspect identified
1b95786be112c79159265b26ff9bf679c6c7ea6c152e8e91e1668913afa5c767,2020-07,Wiltshire Police,Wiltshire Police,-2.123873,51.362050,On or near MALLORY PLACE,E01032071,Wiltshire 021E,Investigation complete; no suspect identified
bdc3871e1f41f93cd2caffca7f8f230d9bb3da0fdc440ef6b721f5bf9c3c5172,2020-07,Wiltshire Police,Wiltshire Police,-1.889309,51.548827,On or near MARLOWE WAY,E01031964,Wiltshire 006B,Action to be taken by another organisation
adc3ef04c6eb2a3ad7aa2a8d72f350a5df4861ee1a8aea756f628cf36f552fd6,2020-07,Wiltshire Police,Wiltshire Police,-1.595661,51.377146,On or near BROOK STREET,E01031843,Wiltshire 029A,Investigation complete; no suspect identified
b8727a03f2772b03dde091e5205f479ccf0e291cd7930fca9b6aa5aa660ed69c,2020-07,Wiltshire Police,Wiltshire Police,-1.816732,51.554320,On or near MARKENFIELD,E01015568,Swindon 014D,Unable to prosecute suspect
373abde760d1811517914cd17483f706847844e3669f29127a95b500896015ff,2020-07,Wiltshire Police,Wiltshire Police,-2.112097,51.462364,On or near Further/Higher Educational Building,E01031918,Wiltshire 011E,Investigation complete; no suspect identified
0e23fedb3ed4e4d48e9bce3b0a1fdb2c83dba820df4a79bd965d6b0268246b93,2020-07,Wiltshire Police,Wiltshire Police,-1.747775,51.588063,On or near Hospital,E01015552,Swindon 009D,Investigation complete; no suspect identified
08664d8c88485d1b748bc5db9833553c6b680d53c15c1bba1e78d900795e6297,2020-07,Wiltshire Police,Wiltshire Police,-1.989224,51.352782,On or near Supermarket,E01031850,Wiltshire 025A,Unable to prosecute suspect
fb73962795719e229cf8d805982e63538128b806a8477995c5ae8e166a35c439,2020-07,Wiltshire Police,Wiltshire Police,-1.655438,51.240023,On or near KENNET ROAD,E01032697,Wiltshire 041G,Investigation complete; no suspect identified
e737461bb77be83e5a266c68f876a56cb317f47d0a6a9e26695288fe250af5db,2020-07,Wiltshire Police,Wiltshire Police,-2.149600,51.380372,On or near SHURNHOLD,E01032062,Wiltshire 022A,Unable to prosecute suspect
7c6380343143e94cb32529b413f5b30d6df3cb1c17f2c2a30e66bced0d088e47,2020-07,Wiltshire Police,Wiltshire Police,-1.661801,51.094821,On or near MIDDLETON,E01032042,Wiltshire 060E,Investigation complete; no suspect identified
