Crime ID,Month,Reported by,Falls within,Longitude,Latitude,Location,LSOA code,LSOA name,Outcome type
27314e4c9241bead87dfaf854cbc3d71d17117f3e9b6b502285eb841b8db540f,2020-07,Wiltshire Police,Wiltshire Police,-1.414149,51.612534,On or near STATION ROAD,E01028723,Vale of White Horse 011C,Unable to prosecute suspect
23325e1c9e7f6dc6f466ba24ba615ae2cff75c1fdfe4f9049246745b4f6b8b76,2020-07,Wiltshire Police,Wiltshire Police,-1.803510,51.082456,On or near HUDSON ROAD,E01032019,Wiltshire 053B,Unable to prosecute suspect
233cb6b175e7cc26d70037357338e00ce0faa83ff5b15ee6031528b401bfcde1,2020-07,Wiltshire Police,Wiltshire Police,-1.777208,51.549352,On or near DEVIZES ROAD,E01015532,Swindon 021D,Unable to prosecute suspect
a749bd882d628f75b1e9972820910dd35574c421f89b209ae20ace1b1e5171f9,2020-07,Wiltshire Police,Wiltshire Police,-2.205304,51.322084,On or near BREWERY WALK,E01032101,Wiltshire 032C,Unable to prosecute suspect
bf9f9745b4ed97b2c73805db5eb30bc5d920403c678ccae399d710a1bf203e75,2020-07,Wiltshire Police,Wiltshire Police,-1.414149,51.612534,On or near STATION ROAD,E01028723,Vale of White Horse 011C,Unable to prosecute suspect
44e3d065d82f9f6b694c7c24f71cf432163bf18b6615133c62eb73c765622eb7,2020-07,Wiltshire Police,Wiltshire Police,-1.790166,51.557054,On or near SHELLEY STREET,E01015494,Swindon 019A,Unable to prosecute suspect
d33ea91ddef544d9c9ca70999bc9eade1c217d60908effbc69eb7749e7929dfe,2020-07,Wiltshire Police,Wiltshire Police,-1.817427,51.604232,On or near ISAMBARD WAY,E01032712,Swindon 027E,Investigation complete; no suspect identified
654ade9fbc553140cc899dd3c937d138e0da1460f6f5505167cea57f8c38a591,2020-07,Wiltshire Police,Wiltshire Police,-1.767300,51.166268,On or near EVERGREEN WAY,E01031976,Wiltshire 048C,Unable to prosecute suspect
0a5c46b52bb9f2b5eac607ad5231a0a92c91a24b9daa34b4fd9ddeb84f15d734,2020-07,Wiltshire Police,Wiltshire Police,-2.138474,51.383695,On or near TRENT CRESCENT,E01032063,Wiltshire 020A,Investigation complete; no suspect identified
9e2e33a96628576ed58ce9d3490acfe91347693cd7ffe9f4d601ff364428d8a1,2020-07,Wiltshire Police,Wiltshire Police,-1.811396,51.603099,On or near MARBECK CLOSE,E01032711,Swindon 027D,Unable to prosecute suspect
1d43367474a94d34718b3a7c4f4536f05d528cdac873e7b051b380ccbef07013,2020-07,Wiltshire Police,Wiltshire Police,-1.747775,51.588063,On or near Hospital,E01015552,Swindon 009D,Unable to prosecute suspect
6efcf627c18811a011a3c6ddbbb4829575e1cc948d4dbb648ca4309d757bb5c0,2020-07,Wiltshire Police,Wiltshire Police,-2.079771,51.505190,On or near WESTLAKE PLACE,E01031939,Wiltshire 008A,Unable to prosecute suspect
1b908835226b9c18ee64075bdda993a39e9f0c0472e68396ba5fe4e077406619,2020-07,Wiltshire Police,Wiltshire Police,-2.135580,51.464137,On or near PATCHWAY,E01031925,Wiltshire 010E,Unable to prosecute suspect
2842a8a8e18fb562a7a8b8e4cf748afe485971f1d8d477e88bd48a39ddc809a7,2020-07,Wiltshire Police,Wiltshire Police,-1.994139,51.441233,On or near WESSEX CLOSE,E01031902,Wiltshire 016C,Unable to prosecute suspect
3f8f8882fd415b98bb7493b0a124e19a1a1de34260a5eae0b1672d19b69477e6,2020-07,Wiltshire Police,Wiltshire Police,-1.994139,51.441233,On or near WESSEX CLOSE,E01031902,Wiltshire 016C,Unable to prosecute suspect
0871d970835bd5a63fcbcc13bdfd0c10e5cfc4cc5501aefdaafffc0d074a2e58,2020-07,Wiltshire Police,Wiltshire Police,-1.866509,51.612813,On or near CRICKLADE ROAD,E01031954,Wiltshire 003A,Unable to prosecute suspect
95d6183c1040e226487be81ad35bd0abf94a09dbd0eb4187602bc9366f142e14,2020-07,Wiltshire Police,Wiltshire Police,-1.820142,51.078760,On or near BOWES LYON COURT,E01032025,Wiltshire 053D,Unable to prosecute suspect
705b2c357aa46590797cf53f10928f1e33470c922eed72459d1f77791c1ca6f9,2020-07,Wiltshire Police,Wiltshire Police,-1.793158,51.070173,On or near BROWN STREET,E01032014,Wiltshire 056A,Unable to prosecute suspect
1c7bd22b188ab89f301c01d2ef8203c4dfe4755bd1c92ddf666350aa6b114f55,2020-07,Wiltshire Police,Wiltshire Police,-2.197924,51.261196,On or near GRYPHON CLOSE,E01032118,Wiltshire 040D,Unable to prosecute suspect
dda87c3a509bc4d5969006a8408942b48c2c037ea7a5a7958654604f1af8fef4,2020-07,Wiltshire Police,Wiltshire Police,-1.864702,51.642599,On or near PIKE HOUSE CLOSE,E01031936,Wiltshire 001D,Unable to prosecute suspect
8f984aaa9aca8d14ac09a1019bac5eb07f31740360b74b8d8fd6d72c24454811,2020-07,Wiltshire Police,Wiltshire Police,-1.651440,51.465605,On or near STOCK LANE,E01031841,Wiltshire 012A,Unable to prosecute suspect
6f98105b95661f281b9ed94d8d5e9b317977a3844b6162516d3e55e6f50a3774,2020-07,Wiltshire Police,Wiltshire Police,-1.620434,51.253277,On or near QUEENS CLOSE,E01031878,Wiltshire 041C,Further investigation is not in the public interest
d93569b20d34a43bea1b76c8753ee3582b449bc219ca5dc4892e2075e8c15fdf,2020-07,Wiltshire Police,Wiltshire Police,-1.845605,51.555153,On or near POYNINGS WAY,E01015499,Swindon 018A,Unable to prosecute suspect
040a85be3ab7a13ed8b2abd43f7174ff43da755f51685e40dc6e217b6d6fe75f,2020-07,Wiltshire Police,Wiltshire Police,-2.152934,51.535445,On or near ROYAL FIELD CLOSE,E01031960,Wiltshire 005D,Unable to prosecute suspect
1a1fa7c00bb51422361eddcfb052077fa2a018a509d0cb7a1ce255dd6cf5385c,2020-07,Wiltshire Police,Wiltshire Police,-1.794788,51.549276,On or near PASTEUR DRIVE,E01032706,Swindon 021E,Action to be taken by another organisation
f97a270e39775a6de7ec2f9406b1b7b0c257d7f4b671c36384b2b3afed1f7c38,2020-07,Wiltshire Police,Wiltshire Police,-1.752779,51.551658,On or near WARDLEY CLOSE,E01015540,Swindon 020C,Unable to prosecute suspect
0f99f0421bc22ec8b324cd708a4de1ae06f7ff108bd54e6c75c9d189a8d7da44,2020-07,Wiltshire Police,Wiltshire Police,-2.209645,51.320530,On or near Shopping Area,E01032086,Wiltshire 031B,Unable to prosecute suspect
adf46d9a530a496d5f38d4183f79e9641dec682b22dbf4b8b260aa3335cd4cf4,2020-07,Wiltshire Police,Wiltshire Police,-2.096985,51.578187,On or near ORCHARD COURT,E01031959,Wiltshire 005C,Unable to prosecute suspect
a9814542141e86af6c98cde8a660e003203c2a988b7c4ecd7185aa930642c863,2020-07,Wiltshire Police,Wiltshire Police,-2.175438,51.204745,On or near COTTON HOUSE GARDENS,E01032103,Wiltshire 044A,Suspect charged
dff5fbaa1f94b6b02c3003cf8b248c4d253a56dc85302bf0b2081c1cedc893ec,2020-07,Wiltshire Police,Wiltshire Police,-2.022716,51.362375,On or near DEVIZES ROAD,E01031846,Wiltshire 028B,Unable to prosecute suspect
15cbdacda36f38fbc0002bc6ea41cd6765c4ad20e1f4bfc709a5a258867da179,2020-07,Wiltshire Police,Wiltshire Police,-1.716722,51.363267,On or near ST ANDREW'S CLOSE,E01031866,Wiltshire 024A,Unable to prosecute suspect
c5d6a0f59e776d4de70e69897ab76274c2b8a90af76ae110ac4456fc80dbf516,2020-07,Wiltshire Police,Wiltshire Police,-2.084411,51.061225,On or near ST JOHNS CLOSE,E01032029,Wiltshire 061B,Investigation complete; no suspect identified
df447fae51f868dba2c710ee137a2517b06d465c666efab4fa1047d64d01bd26,2020-07,Wiltshire Police,Wiltshire Police,-2.099367,51.591717,On or near NIEBULL CLOSE,E01031948,Wiltshire 002C,Unable to prosecute suspect
e574300c6dace662e1a32f140c7bcc259333003383b0cf49bf789479e1f03c4b,2020-07,Wiltshire Police,Wiltshire Police,-1.787542,51.563110,On or near BRIDGE STREET,E01015476,Swindon 015B,Unable to prosecute suspect
8e4cd3e62b69b68a225c0ea229af1b18f57a53d72264d82813084e3b3a70afe3,2020-07,Wiltshire Police,Wiltshire Police,-1.787542,51.563110,On or near BRIDGE STREET,E01015476,Swindon 015B,Unable to prosecute suspect
bce68ff0fa428b0c7f756c13710cc60f33d5dab4b9c4bf23c7ff70da067ed15e,2020-07,Wiltshire Police,Wiltshire Police,-1.983407,51.355452,On or near LONDON ROAD,E01031850,Wiltshire 025A,Unable to prosecute suspect
57469d58fa2624779d084608cb9cd8a6604a1ecf01c5561b94985544a18e4bdc,2020-07,Wiltshire Police,Wiltshire Police,-2.189766,51.322839,On or near GARTH ROAD,E01032099,Wiltshire 032A,Unable to prosecute suspect
b2fba9e6125eb893935370b03d42a93dea6203bdd70a320118957981d1b9668c,2020-07,Wiltshire Police,Wiltshire Police,-2.189766,51.322839,On or near GARTH ROAD,E01032099,Wiltshire 032A,Unable to prosecute suspect
50e845bc2c97cae52ea67ae35a9595d9f52e48068fc5f49f260b03c0888c47a5,2020-07,Wiltshire Police,Wiltshire Police,-1.774275,51.573704,On or near EDINBURGH STREET,E01015509,Swindon 010B,Suspect charged
2fe451248d92b73d5168534d5bf20fabd403a58ae203785691f91c5f2636e870,2020-07,Wiltshire Police,Wiltshire Police,-1.834728,51.551640,On or near GAINSBOROUGH WAY,E01015502,Swindon 022B,Unable to prosecute suspect
60f4d5a97ab8335f739c27e55a7cb5704fd181441bf05243698cd0dc6214f49b,2020-07,Wiltshire Police,Wiltshire Police,-1.970747,51.369180,On or near SERGEANT ROGERS WAY,E01032693,Wiltshire 025H,Unable to prosecute suspect
fc16a4b5a121538cf8cfba5bdbbe796541e811a29f18153e4577ae9682ac026f,2020-07,Wiltshire Police,Wiltshire Police,-1.776315,51.552074,On or near JOINER LANE,E01015534,Swindon 024B,Suspect charged
f3b37d7f1c12e74056a6214050f00b04b3245ef65941e492e6913aa683f7fb08,2020-07,Wiltshire Police,Wiltshire Police,-1.864702,51.642599,On or near PIKE HOUSE CLOSE,E01031936,Wiltshire 001D,Unable to prosecute suspect
f9f7299e48fcc3fa9fef6de250e9c90152f2e830c2d6ccb1c5dc5b9ec8f120d7,2020-07,Wiltshire Police,Wiltshire Police,-2.196862,51.434926,On or near LANCEFIELD PLACE,E01031952,Wiltshire 018F,Unable to prosecute suspect
6095d00a0ef9ac8c95affd372aa6734f125f1fd0dda8743c2f0f0501931d9092,2020-07,Wiltshire Police,Wiltshire Police,-1.775997,51.590359,On or near MARSTON AVENUE,E01015544,Swindon 003B,Unable to prosecute suspect
fb369314518ce05d9b7181950842821b5a1ede72f0114f71e29d5b3417f023a6,2020-07,Wiltshire Police,Wiltshire Police,-1.913339,51.592707,On or near Park/Open Space,E01031956,Wiltshire 003C,Investigation complete; no suspect identified
9af146b83503d36851a03bdf6753b54e00e19ceec881e7ddb9f9ff9d83445eec,2020-07,Wiltshire Police,Wiltshire Police,-1.826121,51.603760,On or near BUTLEIGH ROAD,E01032713,Swindon 026F,Unable to prosecute suspect
2d00c4cb36eab5d4891099f48885e8aaaa0309dc085fbc2fbf2c4bbb3abbbfbc,2020-07,Wiltshire Police,Wiltshire Police,-1.783157,51.566069,On or near Parking Area,E01015476,Swindon 015B,Unable to prosecute suspect
bc03b265ce4978736eb81d3cc72c64e018d2923868e971eea9ad9c2eebc4e257,2020-07,Wiltshire Police,Wiltshire Police,-1.762626,51.560805,On or near SEYMOUR ROAD,E01015573,Swindon 016C,Unable to prosecute suspect
a10c81832998c3ea3b0c3cef734ea7490d3e43f46efc573f4f7534c49c9f00ef,2020-07,Wiltshire Police,Wiltshire Police,-2.201541,51.416135,On or near NESTON CRESCENT,E01031941,Wiltshire 018D,Action to be taken by another organisation
9b110de6ce3021223fe25bc0654592db852e94fa6b51948067d7bc9bf33e24a9,2020-07,Wiltshire Police,Wiltshire Police,-1.741560,51.569302,On or near NEPTUNE CRESCENT,E01015481,Swindon 013A,Further investigation is not in the public interest
1b0bcfa286de42018564d326870db9497c62a00c449b5fad221a4ab50a38877f,2020-07,Wiltshire Police,Wiltshire Police,-1.749656,51.553198,On or near ROYSTON ROAD,E01015541,Swindon 020D,Unable to prosecute suspect
cd7eb8f460eafb52a5a7c8c44f413c67e6804174c9edd3c4932beb9410c2020a,2020-07,Wiltshire Police,Wiltshire Police,-2.083874,51.064121,On or near TARAMAH GARDENS,E01032030,Wiltshire 061C,Unable to prosecute suspect
fdf9b3b915bcc1fee50cfc5a0c6107162d941703a70d2e63cadb88362cf1b177,2020-07,Wiltshire Police,Wiltshire Police,-2.083874,51.064121,On or near TARAMAH GARDENS,E01032030,Wiltshire 061C,Unable to prosecute suspect
114e9c48e839de59b1564cd6b132c1855e409481afe514e723e05ee28f9e47d5,2020-07,Wiltshire Police,Wiltshire Police,-1.750866,51.553498,On or near Supermarket,E01015541,Swindon 020D,Investigation complete; no suspect identified
8a22d09719304b031326064bd667add9e0d05e9cbc0c4127b1816d6dc984938c,2020-07,Wiltshire Police,Wiltshire Police,-1.711644,51.631956,On or near Petrol Station,E01015519,Swindon 001A,Unable to prosecute suspect
1737b4b9071aca80e8f48b84c25143a781781e1ed44f8045a74c2ac2028594c1,2020-07,Wiltshire Police,Wiltshire Police,-1.798337,51.087079,On or near CASTLE ROAD,E01032018,Wiltshire 053A,Investigation complete; no suspect identified
b6241a91cf3930f85d65875b1dbfef138ba13cd939a15216cba1506c2ecf40ad,2020-07,Wiltshire Police,Wiltshire Police,-1.739155,51.578639,On or near PARK STREET,E01015551,Swindon 009C,Unable to prosecute suspect
fc115117000c1e58eb0b65b7d3c434150163065afd8a9aa811b37dd4e2927f1c,2020-07,Wiltshire Police,Wiltshire Police,-1.813498,51.583420,On or near JUBILEE ROAD,E01015528,Swindon 006B,Unable to prosecute suspect
0d34b9be558b132bb5b17c3409f2a428bc4b2ba320cfd2bd51c8c317fdd8da32,2020-07,Wiltshire Police,Wiltshire Police,-2.189766,51.322839,On or near GARTH ROAD,E01032099,Wiltshire 032A,Unable to prosecute suspect
acca65baeb12bfaa82592c0d192c5c8fd11b1019f5199021477ec444de862be5,2020-07,Wiltshire Police,Wiltshire Police,-1.788812,51.562959,On or near Parking Area,E01015476,Swindon 015B,Suspect charged
473c5fe7ef4da78057228f8ffeba51527c65962b7b57450072f700e27c863437,2020-07,Wiltshire Police,Wiltshire Police,-1.788812,51.562959,On or near Parking Area,E01015476,Swindon 015B,Unable to prosecute suspect
0a7f6eff55370d3c00ff264dd3c6d3881653c2ada5088b09add13d6ada1aaee8,2020-07,Wiltshire Police,Wiltshire Police,-1.807375,51.073111,On or near HAWTHORN CLOSE,E01032003,Wiltshire 055C,Investigation complete; no suspect identified
a88115f8b49a3058bba589574084962e2256e9ea6b8e3e99c09209e0265b81c8,2020-07,Wiltshire Police,Wiltshire Police,-1.854894,51.641221,On or near HAMMONDS,E01031936,Wiltshire 001D,Unable to prosecute suspect
8b8d474e0560e42f1759ff8ceb6c7046d58efd023cfd333d38563c55f22c801e,2020-07,Wiltshire Police,Wiltshire Police,-2.116792,51.463258,On or near Shopping Area,E01031912,Wiltshire 011B,Investigation complete; no suspect identified
d7ad7ce96b789c6b60773a265544ce8f8ddfdc28b7d00837fb21c64163044259,2020-07,Wiltshire Police,Wiltshire Police,-1.785821,51.104366,On or near Sports/Recreation Area,E01032011,Wiltshire 057B,Unable to prosecute suspect
f5ee420d0fbdade09141ffe1105f3cdd6974a128cb6b4b14b9ba0591e6b48b6c,2020-07,Wiltshire Police,Wiltshire Police,-2.189766,51.322839,On or near GARTH ROAD,E01032099,Wiltshire 032A,Unable to prosecute suspect
2d2cb2a37d15ec115373804738039c217e1e148f426618413844cea3930060af,2020-07,Wiltshire Police,Wiltshire Police,-1.750672,51.549361,On or near CARSTAIRS AVENUE,E01015541,Swindon 020D,Unable to prosecute suspect
41d93841fbcfb0547da449ce4d0cd0181dfa28b9c0c8e8bb3a7ddab6f159d69a,2020-07,Wiltshire Police,Wiltshire Police,-1.789793,51.069412,On or near Pedestrian Subway,E01032014,Wiltshire 056A,Unable to prosecute suspect
df04bd3f492699a052f02f599838e6e714f2cbb444592ea3924a683869bbe37e,2020-07,Wiltshire Police,Wiltshire Police,-2.189766,51.322839,On or near GARTH ROAD,E01032099,Wiltshire 032A,Unable to prosecute suspect
7d048aa0c8d7567b297f2ad3da196c4d4ff557be159491cf722e81fcaf6adccc,2020-07,Wiltshire Police,Wiltshire Police,-1.859309,51.615421,On or near NEWTH'S LANE,E01031954,Wiltshire 003A,Unable to prosecute suspect
2da84f560aee41c58525ac91429888351e3993681a8ac74f93e4d36a5b0cf0fa,2020-07,Wiltshire Police,Wiltshire Police,-1.811083,51.059836,On or near WILTSHIRE ROAD,E01032008,Wiltshire 058A,Suspect charged
b82ed853b1dd96005f3ea43093cdf982681ecc33f0c162a655f8383515d006c1,2020-07,Wiltshire Police,Wiltshire Police,-1.692389,51.693228,On or near THAMES STREET,E01022210,Cotswold 009F,Unable to prosecute suspect
39f128c89f034c17c2ba52e45185db4a5b75c1966989782e550a33ae25993917,2020-07,Wiltshire Police,Wiltshire Police,-1.777271,51.574833,On or near CRICKLADE ROAD,E01015509,Swindon 010B,Unable to prosecute suspect
819c8281afe44118d4ca7ed1b613e07288d64a4a6c68d83fc6d2a802e2626a65,2020-07,Wiltshire Police,Wiltshire Police,-1.777271,51.574833,On or near CRICKLADE ROAD,E01015509,Swindon 010B,Unable to prosecute suspect
048e54fc56b7f45125ce1cb39152b08e9f1b9e168771c9c9cfbcd0c451079213,2020-07,Wiltshire Police,Wiltshire Police,-2.137094,51.374040,On or near Parking Area,E01032062,Wiltshire 022A,Unable to prosecute suspect
9d317daf32480b028ead79eab8c7fd83759bfe36860d9dc108d0549de36c63bf,2020-07,Wiltshire Police,Wiltshire Police,-1.815061,51.196809,On or near HOWARD-VYSE ROAD,E01031998,Wiltshire 045C,Unable to prosecute suspect
dfbf49a5069d03cb12bbd2dba0d11e92a22452b859c945c544d91180d6ae62b2,2020-07,Wiltshire Police,Wiltshire Police,-1.712401,51.628694,On or near THE GREEN,E01015520,Swindon 001B,Action to be taken by another organisation
b3adb16b062e5f47713c0d383d4ee0a3dcde7ee7ab4fde507e18b305f1c08894,2020-07,Wiltshire Police,Wiltshire Police,-1.781702,51.595639,On or near ENFORD AVENUE,E01015545,Swindon 003C,Unable to prosecute suspect
b507642ec540818b16887b45dcf6a9f9331827402dd4e2b693984692ecc450a5,2020-07,Wiltshire Police,Wiltshire Police,-2.197924,51.261196,On or near GRYPHON CLOSE,E01032118,Wiltshire 040D,Unable to prosecute suspect
371261450c5b9c3e5efe21d86841791ffc8a4c58df9651462e669243e282ab8c,2020-07,Wiltshire Police,Wiltshire Police,-1.712401,51.628694,On or near THE GREEN,E01015520,Swindon 001B,Action to be taken by another organisation
dc87a02b62168ae838502aa91c0a2d7b82cbbc0895ff486a91b8ea76cca6bf9d,2020-07,Wiltshire Police,Wiltshire Police,-1.755376,51.564935,On or near MAITLAND ROAD,E01015575,Swindon 016D,Unable to prosecute suspect
6c257d38706fbd5c76ca5fbcb1d2abe1d2e0cae4d15a7493cf63a79729e8cc38,2020-07,Wiltshire Police,Wiltshire Police,-1.704098,51.530227,On or near CHURCH ROAD,E01015547,Swindon 008C,Unable to prosecute suspect
af67aac88cd2ed2de04467e069751315074fcdf34cc1bb281a7ad996c8bdc4e9,2020-07,Wiltshire Police,Wiltshire Police,-1.784317,51.564749,On or near WELLINGTON STREET,E01015476,Swindon 015B,Unable to prosecute suspect
3f030f71ab17778b24190d16ded5d4254d9e51a1194bf8d8c0fb2cc2832c9d26,2020-07,Wiltshire Police,Wiltshire Police,-1.795266,51.067884,On or near Shopping Area,E01032022,Wiltshire 058C,Unable to prosecute suspect
07c45757d77c3c6266fdf0e8e01f8bc5efb8506fe333a1ea9618a577eafa30ba,2020-07,Wiltshire Police,Wiltshire Police,-2.106531,51.445528,On or near CHANDLER WAY,E01031921,Wiltshire 014B,Unable to prosecute suspect
e0aaaeb687b03d46763404887cd4dbb5af34848144cd7b26f00ebdac77feda04,2020-07,Wiltshire Police,Wiltshire Police,-2.131825,51.454961,On or near KINGSLEY ROAD,E01031928,Wiltshire 011F,Unable to prosecute suspect
3b1a905128f6ffb81e5902eddadade2eb0442f4f6c31d23217c39d868b89cb4a,2020-07,Wiltshire Police,Wiltshire Police,-1.600994,51.378522,On or near COSTER VIEW,E01031843,Wiltshire 029A,Unable to prosecute suspect
ee19281ce06bbfbbf34304a825eaca34131fa615bed6af4bdf84460f6dcdd439,2020-07,Wiltshire Police,Wiltshire Police,-2.128956,51.381809,On or near PHILIP CLOSE,E01032064,Wiltshire 020B,Unable to prosecute suspect
2c7f203df0a5d5e32eb6352e9892da18b98c95cbc32d6f3e46d7f6798ca52c1c,2020-07,Wiltshire Police,Wiltshire Police,-1.814689,51.060974,On or near NORFOLK ROAD,E01032008,Wiltshire 058A,Unable to prosecute suspect
04417217fe7b093b95760de3d515f6581941d4623562d93f1929792ea5a38465,2020-07,Wiltshire Police,Wiltshire Police,-1.835407,51.579344,On or near STOCKBRIDGE COPSE,E01015562,Swindon 011A,Unable to prosecute suspect
89bc88bbcfd37de6de5b8c66d049ad51e6dc8b78c82d5f183b9b004efb49983d,2020-07,Wiltshire Police,Wiltshire Police,-1.746340,50.987254,On or near MOOT LANE,E01031993,Wiltshire 062C,Unable to prosecute suspect
6ebbdc643d2e5e1db7d1513db07ca614585a2beef98c8a970c5789ea1a1653c9,2020-07,Wiltshire Police,Wiltshire Police,-2.137937,51.367753,On or near WAVERLEY GARDENS,E01032068,Wiltshire 022D,Unable to prosecute suspect
f4ff0721516b2a401f5367ed9920dcc97ed0f98aee07891b4137b4604ad1338e,2020-07,Wiltshire Police,Wiltshire Police,-2.211164,51.248188,On or near FRIARS CLOSE,E01032054,Wiltshire 039B,Unable to prosecute suspect
8badde40b9074f4e281c6d3886cad7c230d6967ee28ef467d0e6f53074833267,2020-07,Wiltshire Police,Wiltshire Police,-2.185913,51.264453,On or near DOWNSVIEW ROAD,E01032116,Wiltshire 040B,Unable to prosecute suspect
e6a79c621e4830746011dbec6bad752fd294278bc7a49d7fdd233f2387e6ba24,2020-07,Wiltshire Police,Wiltshire Police,-1.793158,51.070173,On or near BROWN STREET,E01032014,Wiltshire 056A,Unable to prosecute suspect
12f77f77b662d8b6502b54fbc31640ceb4e3734f4bfb47ffe5f5f6d6e2bd478d,2020-07,Wiltshire Police,Wiltshire Police,-1.760345,51.563723,On or near SHIRLEY CLOSE,E01015575,Swindon 016D,Unable to prosecute suspect
efc093e699f49576b238f12f7c22819f2430598d2db9ae3e165cc64c8e31e4e7,2020-07,Wiltshire Police,Wiltshire Police,-1.742050,51.584670,On or near WARNER CLOSE,E01015553,Swindon 009E,Unable to prosecute suspect
ff77f22142c176029fb6d005597b7911556b384e32fc149ee7d515e2a674b71f,2020-07,Wiltshire Police,Wiltshire Police,-2.207046,51.304188,On or near INGLESHAM CLOSE,E01032092,Wiltshire 035A,Unable to prosecute suspect
7330cbe04ccc84874b5f1959afc9a1e076493bdbc8639f8585baa96fe91ee0d4,2020-07,Wiltshire Police,Wiltshire Police,-1.769767,51.340086,On or near CORONATION CLOSE,E01031869,Wiltshire 024B,Unable to prosecute suspect
c7d82e5c6eb68fe1adbac72c3b1176eda8f316b8b0ea4ca6e3f7e5becb56feab,2020-07,Wiltshire Police,Wiltshire Police,-2.194097,51.359545,On or near BECKERLEY LANE,E01032057,Wiltshire 021C,Unable to prosecute suspect
644a5b3eb747b63e861f4d8fbc06fd6b1e70acc04af82dce870387dc2410ab14,2020-07,Wiltshire Police,Wiltshire Police,-1.788009,51.244393,On or near DOWNS VIEW,E01031867,Wiltshire 038B,Unable to prosecute suspect
0da70d15cdd1cbc20574280a179bfa2d8e9552bd6cce8fce7bc30f5dfdd75f84,2020-07,Wiltshire Police,Wiltshire Police,-2.188050,51.268352,On or near BRAMBLE DRIVE,E01032116,Wiltshire 040B,Unable to prosecute suspect
1bf1a0139b063f7e3eb51f19fcdf01931813509f5832bfc778cc22b1ef0e8be0,2020-07,Wiltshire Police,Wiltshire Police,-1.728808,51.551866,On or near CONAN DOYLE WALK,E01015488,Swindon 023B,Unable to prosecute suspect
e4879328db6c545b9085ab7c7cd439b7113ed75f57b75762648686ca68a0158f,2020-07,Wiltshire Police,Wiltshire Police,-1.820813,51.550901,On or near STANSFIELD CLOSE,E01015571,Swindon 022F,Unable to prosecute suspect
79e56ad7297aa03d1803aeec6990a70a17a9a48a1d81a1b9c16e18a33287f936,2020-07,Wiltshire Police,Wiltshire Police,-2.210924,51.573640,On or near WOODS CLOSE,E01031958,Wiltshire 005B,Unable to prosecute suspect
9384222b73d3e040b8234f753aee6d5d2efe03d11faba67dc0955038a583d1ce,2020-07,Wiltshire Police,Wiltshire Police,-1.779389,51.171498,On or near Bus/Coach Station,E01031979,Wiltshire 048F,Unable to prosecute suspect
8ba535b45947f22dde85e93e6ad0e0278df2f981b5ac74599f9c2f1dbcfc7d35,2020-07,Wiltshire Police,Wiltshire Police,-1.779389,51.171498,On or near Bus/Coach Station,E01031979,Wiltshire 048F,Unable to prosecute suspect
816045c45227d6f4950a424091bc36542cfd720f745ad1e67b06ab693db38309,2020-07,Wiltshire Police,Wiltshire Police,-1.743653,50.988903,On or near MOOT CLOSE,E01031993,Wiltshire 062C,Unable to prosecute suspect
d820cbff528f292649df71bf457a151df38a5f054dbea53f47ad416e1e98145c,2020-07,Wiltshire Police,Wiltshire Police,-1.819283,51.079317,On or near LADYSMITH ROAD,E01032025,Wiltshire 053D,Unable to prosecute suspect
a920156718c5100b42acbeff5a256597bfac76479c095f1a415476cdbdbabc70,2020-07,Wiltshire Police,Wiltshire Police,-2.185913,51.264453,On or near DOWNSVIEW ROAD,E01032116,Wiltshire 040B,Unable to prosecute suspect
6a81bb0a3339b0477e037b9e9fd5f91da09fec4971bd0b2801480b711d8de126,2020-07,Wiltshire Police,Wiltshire Police,-2.201598,51.311346,On or near LAMB ALE GREEN,E01032093,Wiltshire 035B,Unable to prosecute suspect
552573225d95173337177fcf28961feff2b4a371d85b0ad190e17e5e892a6bf4,2020-07,Wiltshire Police,Wiltshire Police,-1.998627,51.442079,On or near PENN COURT,E01031895,Wiltshire 015A,Unable to prosecute suspect
59ea0ca38798296698f7e3084fef69af92be8527209df34e70176ee4132fdad4,2020-07,Wiltshire Police,Wiltshire Police,-1.781413,51.583787,On or near HAZEL GROVE,E01015506,Swindon 007A,Unable to prosecute suspect
1ff00564428d70461bbaec5492915d469938d3a4c8fa73d79b129665576a68ea,2020-07,Wiltshire Police,Wiltshire Police,-1.788520,51.579206,On or near WAVELL ROAD,E01015580,Swindon 007D,Unable to prosecute suspect
7987274e5a4b5ebcb07ad27a43d4a6cdc177d90bc1d12cb6bae1ff518a3c52f5,2020-07,Wiltshire Police,Wiltshire Police,-1.794589,51.555111,On or near STANMORE STREET,E01015498,Swindon 021B,Unable to prosecute suspect
0bc41fda47a9aa8e4c31fa775c1728712c54b9a9f0e9de05cc25eec76336ad75,2020-07,Wiltshire Police,Wiltshire Police,-1.763395,51.169273,On or near TANNERS FIELD,E01031978,Wiltshire 048E,Investigation complete; no suspect identified
67bed0c66dd3ed0163ffaa9ef6cc3d511b2660106a8a1acd6748afba4c003d55,2020-07,Wiltshire Police,Wiltshire Police,-1.712125,51.280783,On or near WEST VIEW,E01031849,Wiltshire 029C,Unable to prosecute suspect
4d44b23fd49f83641fb0590980a53bb2d71256c25a98243b06029756dcbabd1f,2020-07,Wiltshire Police,Wiltshire Police,-1.747828,51.583738,On or near FRANK WARMAN COURT,E01015553,Swindon 009E,Unable to prosecute suspect
840bd676b25a38267da1938848f63c4224f58e5f9ba2f25836c09ace47b19e40,2020-07,Wiltshire Police,Wiltshire Police,-2.100420,51.080285,On or near WOOD LANE,E01032010,Wiltshire 050A,Investigation complete; no suspect identified
eca2f6f0cc4f3d3dbe1ee76c328dfaaf754e48675bb92a36a240cfb318e82841,2020-07,Wiltshire Police,Wiltshire Police,-2.168597,51.201221,On or near BOREHAM ROAD,E01032105,Wiltshire 042B,Unable to prosecute suspect
773e113c684024df35e394a0837172e244141f1b0c95b815de8fdb46ba8de1f4,2020-07,Wiltshire Police,Wiltshire Police,-2.214901,51.318318,On or near NEWTOWN,E01032086,Wiltshire 031B,Unable to prosecute suspect
0a15453fb54f7e984b997b26b69230f120012ad2ee3beddac745d1105398c8d8,2020-07,Wiltshire Police,Wiltshire Police,-2.029410,51.497031,On or near Park/Open Space,E01031891,Wiltshire 013A,Unable to prosecute suspect
45782fb4a74c0000a493071fa53732c8c040bbdba1080ce6c81187e60c08311a,2020-07,Wiltshire Police,Wiltshire Police,-1.788608,51.563417,On or near SHEPPARD STREET,E01015476,Swindon 015B,Unable to prosecute suspect
